=== SAVE RECORD DEBUG ===
POST data: Array
(
    [titulo] => lll
    [hora_inicial] => 
    [hora_exp] => 
    [color] => Otros
    [repetitivo] => 1
    [repeat_dates] => 29/08/2025,30/08/2025,31/08/2025
    [mensaje] => <p>lllll</p>
    [repetitivo_fechas] => ["2025-08-29 00:00:00","2025-08-30 00:00:00","2025-08-31 00:00:00"]
    [todo_el_dia] => 1
)

FILES data: Array
(
    [files] => Array
        (
            [name] => 
            [full_path] => 
            [type] => 
            [tmp_name] => 
            [error] => 4
            [size] => 0
        )

    [pdf] => Array
        (
            [name] => 
            [full_path] => 
            [type] => 
            [tmp_name] => 
            [error] => 4
            [size] => 0
        )

)

repetitivo_fechas exists: YES
repetitivo_fechas value: ["2025-08-29 00:00:00","2025-08-30 00:00:00","2025-08-31 00:00:00"]
repetitivo_fechas empty check: NOT EMPTY
After validation - error: FALSE
Category: Otros
Starting database operations...
PDF filename: NULL
Processing repetitive dates...
Decoded dates: Array
(
    [0] => 2025-08-29 00:00:00
    [1] => 2025-08-30 00:00:00
    [2] => 2025-08-31 00:00:00
)

SQL: INSERT INTO memos (repetitivo_fechas, contenido, titulo, color, pdf) 
								VALUES (?, ?, ?, ?, ?)
Params: Array
(
    [0] => ["2025-08-29 00:00:00","2025-08-30 00:00:00","2025-08-31 00:00:00"]
    [1] => <p>lllll</p>
    [2] => lll
    [3] => Otros
    [4] => 
)

Execute result: SUCCESS
Affected rows: 1
Transaction committed successfully
Final response: {"msg":"El mensaje se guard\u00f3 con \u00e9xito.","error":false,"focus":""}
=== END DEBUG ===

=== SAVE RECORD DEBUG ===
POST data: Array
(
    [titulo] => aaa
    [fecha] => 30/08/2025
    [hora_inicial] => 05:15
    [fecha_exp] => 
    [hora_exp] => 20:17
    [color] => Circular
    [repeat_dates] => 
    [mensaje] => <p>aaa</p>
    [fecha_datetime] => 2025-08-30 05:15:00
    [todo_el_dia] => 0
)

FILES data: Array
(
    [files] => Array
        (
            [name] => 
            [full_path] => 
            [type] => 
            [tmp_name] => 
            [error] => 4
            [size] => 0
        )

    [pdf] => Array
        (
            [name] => matriz impacto esfuerzo fase 2.png
            [full_path] => matriz impacto esfuerzo fase 2.png
            [type] => image/png
            [tmp_name] => C:\xampp\tmp\phpE54F.tmp
            [error] => 0
            [size] => 72458
        )

)

repetitivo_fechas exists: NO
After validation - error: FALSE
Category: Circular
Starting database operations...
PDF filename: 68b21878a09bd.png
Processing regular dates...
Processed fecha: 2025-08-30 05:15:00
Processed fechaExp: NULL
SQL: INSERT INTO memos (fecha, fechaExp, contenido, titulo, color, pdf)
							VALUES (?, ?, ?, ?, ?, ?)
Params: Array
(
    [0] => 2025-08-30 05:15:00
    [1] => 
    [2] => <p>aaa</p>
    [3] => aaa
    [4] => Circular
    [5] => 68b21878a09bd.png
)

Execute result: SUCCESS
Affected rows: 1
Transaction committed successfully
Final response: {"msg":"El mensaje se guard\u00f3 con \u00e9xito.","error":false,"focus":""}
=== END DEBUG ===

=== SAVE RECORD DEBUG ===
POST data: Array
(
    [id] => 501
    [titulo] => aaa
    [fecha] => 30/08/2025
    [hora_inicial] => 05:15
    [fecha_exp] => 
    [hora_exp] => 
    [color] => Avisos temporales
    [mensaje] => <p>aaa</p>
    [colorHex] => #FF9800
    [fecha_datetime] => 2025-08-30 05:15:00
    [todo_el_dia] => 0
)

FILES data: Array
(
    [files] => Array
        (
            [name] => 
            [full_path] => 
            [type] => 
            [tmp_name] => 
            [error] => 4
            [size] => 0
        )

    [pdf] => Array
        (
            [name] => 
            [full_path] => 
            [type] => 
            [tmp_name] => 
            [error] => 4
            [size] => 0
        )

)

repetitivo_fechas exists: NO
After validation - error: FALSE
Category: Avisos temporales
Starting database operations...
PDF filename: NULL
Processing regular dates...
Processed fecha: 2025-08-30 05:15:00
Processed fechaExp: NULL
SQL: INSERT INTO memos (fecha, fechaExp, contenido, titulo, color, pdf)
							VALUES (?, ?, ?, ?, ?, ?)
Params: Array
(
    [0] => 2025-08-30 05:15:00
    [1] => 
    [2] => <p>aaa</p>
    [3] => aaa
    [4] => Avisos temporales
    [5] => 
)

Execute result: SUCCESS
Affected rows: 1
Transaction committed successfully
Final response: {"msg":"El mensaje se guard\u00f3 con \u00e9xito.","error":false,"focus":""}
=== END DEBUG ===

=== SAVE RECORD DEBUG ===
POST data: Array
(
    [titulo] => aaa
    [fecha] => 29/08/2025
    [hora_inicial] => 03:19
    [fecha_exp] => 31/08/2025
    [hora_exp] => 18:21
    [color] => Vacaciones
    [repeat_dates] => 
    [mensaje] => <p>aaa</p>
    [fecha_datetime] => 2025-08-29 03:19:00
    [fecha_exp_datetime] => 2025-08-31 18:21:00
    [todo_el_dia] => 0
)

FILES data: Array
(
    [files] => Array
        (
            [name] => 
            [full_path] => 
            [type] => 
            [tmp_name] => 
            [error] => 4
            [size] => 0
        )

    [pdf] => Array
        (
            [name] => 
            [full_path] => 
            [type] => 
            [tmp_name] => 
            [error] => 4
            [size] => 0
        )

)

repetitivo_fechas exists: NO
After validation - error: FALSE
Category: Vacaciones
Starting database operations...
PDF filename: NULL
Processing regular dates...
Processed fecha: 2025-08-29 03:19:00
Processed fechaExp: 2025-08-31 18:21:00
SQL: INSERT INTO memos (fecha, fechaExp, contenido, titulo, color, pdf)
							VALUES (?, ?, ?, ?, ?, ?)
Params: Array
(
    [0] => 2025-08-29 03:19:00
    [1] => 2025-08-31 18:21:00
    [2] => <p>aaa</p>
    [3] => aaa
    [4] => Vacaciones
    [5] => 
)

Execute result: SUCCESS
Affected rows: 1
Transaction committed successfully
Final response: {"msg":"El mensaje se guard\u00f3 con \u00e9xito.","error":false,"focus":""}
=== END DEBUG ===

=== SAVE RECORD DEBUG ===
POST data: Array
(
    [titulo] => bbb
    [hora_inicial] => 
    [hora_exp] => 
    [color] => Circular
    [repetitivo] => 1
    [repeat_dates] => 29/08/2025,30/08/2025,31/08/2025
    [mensaje] => <p>bbb</p>
    [repetitivo_fechas] => ["2025-08-29 00:00:00","2025-08-30 00:00:00","2025-08-31 00:00:00"]
    [todo_el_dia] => 1
)

FILES data: Array
(
    [files] => Array
        (
            [name] => 
            [full_path] => 
            [type] => 
            [tmp_name] => 
            [error] => 4
            [size] => 0
        )

    [pdf] => Array
        (
            [name] => 
            [full_path] => 
            [type] => 
            [tmp_name] => 
            [error] => 4
            [size] => 0
        )

)

repetitivo_fechas exists: YES
repetitivo_fechas value: ["2025-08-29 00:00:00","2025-08-30 00:00:00","2025-08-31 00:00:00"]
repetitivo_fechas empty check: NOT EMPTY
After validation - error: FALSE
Category: Circular
Starting database operations...
PDF filename: NULL
Processing repetitive dates...
Decoded dates: Array
(
    [0] => 2025-08-29 00:00:00
    [1] => 2025-08-30 00:00:00
    [2] => 2025-08-31 00:00:00
)

SQL: INSERT INTO memos (repetitivo_fechas, contenido, titulo, color, pdf) 
								VALUES (?, ?, ?, ?, ?)
Params: Array
(
    [0] => ["2025-08-29 00:00:00","2025-08-30 00:00:00","2025-08-31 00:00:00"]
    [1] => <p>bbb</p>
    [2] => bbb
    [3] => Circular
    [4] => 
)

Execute result: SUCCESS
Affected rows: 1
Transaction committed successfully
Final response: {"msg":"El mensaje se guard\u00f3 con \u00e9xito.","error":false,"focus":""}
=== END DEBUG ===

=== SAVE RECORD DEBUG ===
POST data: Array
(
    [titulo] => ccc
    [hora_inicial] => 
    [hora_exp] => 
    [color] => Cobranza
    [repetitivo] => 1
    [repeat_dates] => 27/08/2025,28/08/2025,29/08/2025
    [mensaje] => <p>ccc</p>
    [repetitivo_fechas] => ["2025-08-27 00:00:00","2025-08-28 00:00:00","2025-08-29 00:00:00"]
    [todo_el_dia] => 1
)

FILES data: Array
(
    [files] => Array
        (
            [name] => 
            [full_path] => 
            [type] => 
            [tmp_name] => 
            [error] => 4
            [size] => 0
        )

    [pdf] => Array
        (
            [name] => 
            [full_path] => 
            [type] => 
            [tmp_name] => 
            [error] => 4
            [size] => 0
        )

)

repetitivo_fechas exists: YES
repetitivo_fechas value: ["2025-08-27 00:00:00","2025-08-28 00:00:00","2025-08-29 00:00:00"]
repetitivo_fechas empty check: NOT EMPTY
After validation - error: FALSE
Category: Cobranza
Starting database operations...
PDF filename: NULL
Processing repetitive dates...
Decoded dates: Array
(
    [0] => 2025-08-27 00:00:00
    [1] => 2025-08-28 00:00:00
    [2] => 2025-08-29 00:00:00
)

SQL: INSERT INTO memos (repetitivo_fechas, contenido, titulo, color, pdf) 
								VALUES (?, ?, ?, ?, ?)
Params: Array
(
    [0] => ["2025-08-27 00:00:00","2025-08-28 00:00:00","2025-08-29 00:00:00"]
    [1] => <p>ccc</p>
    [2] => ccc
    [3] => Cobranza
    [4] => 
)

Execute result: SUCCESS
Affected rows: 1
Transaction committed successfully
Final response: {"msg":"El mensaje se guard\u00f3 con \u00e9xito.","error":false,"focus":""}
=== END DEBUG ===

=== SAVE RECORD DEBUG ===
POST data: Array
(
    [titulo] => ddd
    [fecha] => 20/08/2025
    [hora_inicial] => 
    [fecha_exp] => 
    [hora_exp] => 
    [color] => Otros
    [repeat_dates] => 
    [mensaje] => <p>ddd</p>
    [fecha_datetime] => 2025-08-20 00:00:00
    [todo_el_dia] => 1
)

FILES data: Array
(
    [files] => Array
        (
            [name] => 
            [full_path] => 
            [type] => 
            [tmp_name] => 
            [error] => 4
            [size] => 0
        )

    [pdf] => Array
        (
            [name] => 
            [full_path] => 
            [type] => 
            [tmp_name] => 
            [error] => 4
            [size] => 0
        )

)

repetitivo_fechas exists: NO
After validation - error: FALSE
Category: Otros
Starting database operations...
PDF filename: NULL
Processing regular dates...
Processed fecha: 2025-08-20 00:00:00
Processed fechaExp: NULL
SQL: INSERT INTO memos (fecha, fechaExp, contenido, titulo, color, pdf)
							VALUES (?, ?, ?, ?, ?, ?)
Params: Array
(
    [0] => 2025-08-20 00:00:00
    [1] => 
    [2] => <p>ddd</p>
    [3] => ddd
    [4] => Otros
    [5] => 
)

Execute result: SUCCESS
Affected rows: 1
Transaction committed successfully
Final response: {"msg":"El mensaje se guard\u00f3 con \u00e9xito.","error":false,"focus":""}
=== END DEBUG ===

=== SAVE RECORD DEBUG ===
POST data: Array
(
    [titulo] => ddd
    [hora_inicial] => 16:31
    [hora_exp] => 22:34
    [color] => Otros
    [repetitivo] => 1
    [repeat_dates] => 21/08/2025,22/08/2025,23/08/2025
    [mensaje] => <p>ddd</p>
    [repetitivo_fechas] => ["2025-08-21 00:00:00","2025-08-22 00:00:00","2025-08-23 00:00:00"]
    [todo_el_dia] => 0
)

FILES data: Array
(
    [files] => Array
        (
            [name] => 
            [full_path] => 
            [type] => 
            [tmp_name] => 
            [error] => 4
            [size] => 0
        )

    [pdf] => Array
        (
            [name] => 
            [full_path] => 
            [type] => 
            [tmp_name] => 
            [error] => 4
            [size] => 0
        )

)

repetitivo_fechas exists: YES
repetitivo_fechas value: ["2025-08-21 00:00:00","2025-08-22 00:00:00","2025-08-23 00:00:00"]
repetitivo_fechas empty check: NOT EMPTY
After validation - error: FALSE
Category: Otros
Starting database operations...
PDF filename: NULL
Processing repetitive dates...
Decoded dates: Array
(
    [0] => 2025-08-21 00:00:00
    [1] => 2025-08-22 00:00:00
    [2] => 2025-08-23 00:00:00
)

SQL: INSERT INTO memos (repetitivo_fechas, contenido, titulo, color, pdf) 
								VALUES (?, ?, ?, ?, ?)
Params: Array
(
    [0] => ["2025-08-21 00:00:00","2025-08-22 00:00:00","2025-08-23 00:00:00"]
    [1] => <p>ddd</p>
    [2] => ddd
    [3] => Otros
    [4] => 
)

Execute result: SUCCESS
Affected rows: 1
Transaction committed successfully
Final response: {"msg":"El mensaje se guard\u00f3 con \u00e9xito.","error":false,"focus":""}
=== END DEBUG ===

=== SAVE RECORD DEBUG ===
POST data: Array
(
    [titulo] => rrr
    [hora_inicial] => 
    [hora_exp] => 
    [color] => Otros
    [repetitivo] => 1
    [repeat_dates] => 01/09/2025,02/09/2025,03/09/2025
    [mensaje] => <p>rrr</p>
    [repetitivo_fechas] => ["2025-09-01 00:00:00","2025-09-02 00:00:00","2025-09-03 00:00:00"]
    [todo_el_dia] => 1
)

FILES data: Array
(
    [files] => Array
        (
            [name] => 
            [full_path] => 
            [type] => 
            [tmp_name] => 
            [error] => 4
            [size] => 0
        )

    [pdf] => Array
        (
            [name] => 
            [full_path] => 
            [type] => 
            [tmp_name] => 
            [error] => 4
            [size] => 0
        )

)

repetitivo_fechas exists: YES
repetitivo_fechas value: ["2025-09-01 00:00:00","2025-09-02 00:00:00","2025-09-03 00:00:00"]
repetitivo_fechas empty check: NOT EMPTY
After validation - error: FALSE
Category: Otros
Starting database operations...
PDF filename: NULL
Processing repetitive dates...
Decoded dates: Array
(
    [0] => 2025-09-01 00:00:00
    [1] => 2025-09-02 00:00:00
    [2] => 2025-09-03 00:00:00
)

SQL: INSERT INTO memos (repetitivo_fechas, contenido, titulo, color, pdf) 
								VALUES (?, ?, ?, ?, ?)
Params: Array
(
    [0] => ["2025-09-01 00:00:00","2025-09-02 00:00:00","2025-09-03 00:00:00"]
    [1] => <p>rrr</p>
    [2] => rrr
    [3] => Otros
    [4] => 
)

Execute result: SUCCESS
Affected rows: 1
Transaction committed successfully
Final response: {"msg":"El mensaje se guard\u00f3 con \u00e9xito.","error":false,"focus":""}
=== END DEBUG ===

=== SAVE RECORD DEBUG ===
POST data: Array
(
    [id] => 508
    [titulo] => rrr
    [fecha] => 25/08/2025
    [hora_inicial] => 
    [fecha_exp] => 09/09/2025
    [hora_exp] => 
    [color] => Otros
    [repeat_dates] => 01 00:00:00/09/2025,02 00:00:00/09/2025,03 00:00:00/09/2025,01/09/2025,02/09/2025
    [mensaje] => <p>rrr</p>
    [colorHex] => #9E9E9E
    [fecha_datetime] => 2025-08-25 00:00:00
    [fecha_exp_datetime] => 2025-09-09 23:59:00
    [todo_el_dia] => 1
)

FILES data: Array
(
    [files] => Array
        (
            [name] => 
            [full_path] => 
            [type] => 
            [tmp_name] => 
            [error] => 4
            [size] => 0
        )

    [pdf] => Array
        (
            [name] => 
            [full_path] => 
            [type] => 
            [tmp_name] => 
            [error] => 4
            [size] => 0
        )

)

repetitivo_fechas exists: NO
After validation - error: FALSE
Category: Otros
Starting database operations...
PDF filename: NULL
Processing regular dates...
Processed fecha: 2025-08-25 00:00:00
Processed fechaExp: 2025-09-09 23:59:59
SQL: INSERT INTO memos (fecha, fechaExp, contenido, titulo, color, pdf)
							VALUES (?, ?, ?, ?, ?, ?)
Params: Array
(
    [0] => 2025-08-25 00:00:00
    [1] => 2025-09-09 23:59:59
    [2] => <p>rrr</p>
    [3] => rrr
    [4] => Otros
    [5] => 
)

Execute result: SUCCESS
Affected rows: 1
Transaction committed successfully
Final response: {"msg":"El mensaje se guard\u00f3 con \u00e9xito.","error":false,"focus":""}
=== END DEBUG ===

=== SAVE RECORD DEBUG ===
POST data: Array
(
    [id] => 509
    [titulo] => rrr
    [hora_inicial] => 00:00
    [hora_exp] => 23:59
    [color] => Otros
    [repetitivo] => 1
    [repeat_dates] => 01/09/2025,02/09/2025
    [mensaje] => <p>rrr</p>
    [colorHex] => #9E9E9E
    [repetitivo_fechas] => ["2025-09-01","2025-09-02"]
    [todo_el_dia] => 1
)

FILES data: Array
(
    [files] => Array
        (
            [name] => 
            [full_path] => 
            [type] => 
            [tmp_name] => 
            [error] => 4
            [size] => 0
        )

    [pdf] => Array
        (
            [name] => 
            [full_path] => 
            [type] => 
            [tmp_name] => 
            [error] => 4
            [size] => 0
        )

)

repetitivo_fechas exists: YES
repetitivo_fechas value: ["2025-09-01","2025-09-02"]
repetitivo_fechas empty check: NOT EMPTY
After validation - error: FALSE
Category: Otros
Starting database operations...
PDF filename: NULL
Processing repetitive dates...
Decoded dates: Array
(
    [0] => 2025-09-01
    [1] => 2025-09-02
)

SQL: INSERT INTO memos (repetitivo_fechas, contenido, titulo, color, pdf) 
								VALUES (?, ?, ?, ?, ?)
Params: Array
(
    [0] => ["2025-09-01","2025-09-02"]
    [1] => <p>rrr</p>
    [2] => rrr
    [3] => Otros
    [4] => 
)

Execute result: SUCCESS
Affected rows: 1
Transaction committed successfully
Final response: {"msg":"El mensaje se guard\u00f3 con \u00e9xito.","error":false,"focus":""}
=== END DEBUG ===

=== SAVE RECORD DEBUG ===
POST data: Array
(
    [id] => 510
    [titulo] => rrr
    [hora_inicial] => 
    [hora_exp] => 
    [color] => Otros
    [repetitivo] => 1
    [repeat_dates] => 01/09/2025,02/09/2025
    [mensaje] => <p>rrr</p>
    [colorHex] => #9E9E9E
    [repetitivo_fechas] => ["2025-09-01","2025-09-02"]
    [todo_el_dia] => 1
)

FILES data: Array
(
    [files] => Array
        (
            [name] => 
            [full_path] => 
            [type] => 
            [tmp_name] => 
            [error] => 4
            [size] => 0
        )

    [pdf] => Array
        (
            [name] => 
            [full_path] => 
            [type] => 
            [tmp_name] => 
            [error] => 4
            [size] => 0
        )

)

repetitivo_fechas exists: YES
repetitivo_fechas value: ["2025-09-01","2025-09-02"]
repetitivo_fechas empty check: NOT EMPTY
After validation - error: FALSE
Category: Otros
Starting database operations...
PDF filename: NULL
Processing repetitive dates...
Decoded dates: Array
(
    [0] => 2025-09-01
    [1] => 2025-09-02
)

SQL: INSERT INTO memos (repetitivo_fechas, contenido, titulo, color, pdf) 
								VALUES (?, ?, ?, ?, ?)
Params: Array
(
    [0] => ["2025-09-01","2025-09-02"]
    [1] => <p>rrr</p>
    [2] => rrr
    [3] => Otros
    [4] => 
)

Execute result: SUCCESS
Affected rows: 1
Transaction committed successfully
Final response: {"msg":"El mensaje se guard\u00f3 con \u00e9xito.","error":false,"focus":""}
=== END DEBUG ===

=== SAVE RECORD DEBUG ===
POST data: Array
(
    [id] => 511
    [titulo] => rrr
    [hora_inicial] => 
    [hora_exp] => 
    [color] => Otros
    [repetitivo] => 1
    [repeat_dates] => 01/09/2025,02/09/2025,03/09/2025
    [mensaje] => <p>rrr</p>
    [colorHex] => #9E9E9E
    [repetitivo_fechas] => ["2025-09-01","2025-09-02","2025-09-03"]
    [todo_el_dia] => 1
)

FILES data: Array
(
    [files] => Array
        (
            [name] => 
            [full_path] => 
            [type] => 
            [tmp_name] => 
            [error] => 4
            [size] => 0
        )

    [pdf] => Array
        (
            [name] => 
            [full_path] => 
            [type] => 
            [tmp_name] => 
            [error] => 4
            [size] => 0
        )

)

repetitivo_fechas exists: YES
repetitivo_fechas value: ["2025-09-01","2025-09-02","2025-09-03"]
repetitivo_fechas empty check: NOT EMPTY
After validation - error: FALSE
Category: Otros
Starting database operations...
PDF filename: NULL
Processing repetitive dates...
Decoded dates: Array
(
    [0] => 2025-09-01
    [1] => 2025-09-02
    [2] => 2025-09-03
)

SQL: INSERT INTO memos (repetitivo_fechas, contenido, titulo, color, pdf) 
								VALUES (?, ?, ?, ?, ?)
Params: Array
(
    [0] => ["2025-09-01","2025-09-02","2025-09-03"]
    [1] => <p>rrr</p>
    [2] => rrr
    [3] => Otros
    [4] => 
)

Execute result: SUCCESS
Affected rows: 1
Transaction committed successfully
Final response: {"msg":"El mensaje se guard\u00f3 con \u00e9xito.","error":false,"focus":""}
=== END DEBUG ===

=== SAVE RECORD DEBUG ===
POST data: Array
(
    [id] => 512
    [titulo] => rrr
    [hora_inicial] => 
    [hora_exp] => 
    [color] => Otros
    [repetitivo] => 1
    [repeat_dates] => 01/09/2025,02/09/2025,03/09/2025
    [mensaje] => <p>rrr</p>
    [colorHex] => #9E9E9E
    [repetitivo_fechas] => ["2025-09-01","2025-09-02","2025-09-03"]
    [todo_el_dia] => 1
)

FILES data: Array
(
    [files] => Array
        (
            [name] => 
            [full_path] => 
            [type] => 
            [tmp_name] => 
            [error] => 4
            [size] => 0
        )

    [pdf] => Array
        (
            [name] => 
            [full_path] => 
            [type] => 
            [tmp_name] => 
            [error] => 4
            [size] => 0
        )

)

repetitivo_fechas exists: YES
repetitivo_fechas value: ["2025-09-01","2025-09-02","2025-09-03"]
repetitivo_fechas empty check: NOT EMPTY
After validation - error: FALSE
Category: Otros
Starting database operations...
PDF filename: NULL
Processing repetitive dates...
Decoded dates: Array
(
    [0] => 2025-09-01
    [1] => 2025-09-02
    [2] => 2025-09-03
)

SQL: INSERT INTO memos (repetitivo_fechas, contenido, titulo, color, pdf) 
								VALUES (?, ?, ?, ?, ?)
Params: Array
(
    [0] => ["2025-09-01","2025-09-02","2025-09-03"]
    [1] => <p>rrr</p>
    [2] => rrr
    [3] => Otros
    [4] => 
)

Execute result: SUCCESS
Affected rows: 1
Transaction committed successfully
Final response: {"msg":"El mensaje se guard\u00f3 con \u00e9xito.","error":false,"focus":""}
=== END DEBUG ===

=== SAVE RECORD DEBUG ===
POST data: Array
(
    [titulo] => fff
    [fecha] => 02/09/2025
    [hora_inicial] => 
    [fecha_exp] => 03/09/2025
    [hora_exp] => 
    [color] => Circular
    [repeat_dates] => 
    [mensaje] => <p>fff</p>
    [fecha_datetime] => 2025-09-02 00:00:00
    [fecha_exp_datetime] => 2025-09-03 23:59:00
    [todo_el_dia] => 1
)

FILES data: Array
(
    [files] => Array
        (
            [name] => 
            [full_path] => 
            [type] => 
            [tmp_name] => 
            [error] => 4
            [size] => 0
        )

    [pdf] => Array
        (
            [name] => 
            [full_path] => 
            [type] => 
            [tmp_name] => 
            [error] => 4
            [size] => 0
        )

)

repetitivo_fechas exists: NO
After validation - error: FALSE
Category: Circular
Starting database operations...
PDF filename: NULL
Processing regular dates...
Processed fecha: 2025-09-02 00:00:00
Processed fechaExp: 2025-09-03 23:59:59
SQL: INSERT INTO memos (fecha, fechaExp, contenido, titulo, color, pdf)
							VALUES (?, ?, ?, ?, ?, ?)
Params: Array
(
    [0] => 2025-09-02 00:00:00
    [1] => 2025-09-03 23:59:59
    [2] => <p>fff</p>
    [3] => fff
    [4] => Circular
    [5] => 
)

Execute result: SUCCESS
Affected rows: 1
Transaction committed successfully
Final response: {"msg":"El mensaje se guard\u00f3 con \u00e9xito.","error":false,"focus":""}
=== END DEBUG ===

=== SAVE RECORD DEBUG ===
POST data: Array
(
    [id] => 514
    [titulo] => fff
    [hora_inicial] => 00:00
    [hora_exp] => 23:59
    [color] => Circular
    [repetitivo] => 1
    [repeat_dates] => 04/09/2025,05/09/2025,06/09/2025
    [mensaje] => <p>fff</p>
    [repetitivo_fechas] => ["2025-09-04","2025-09-05","2025-09-06"]
    [todo_el_dia] => 1
)

FILES data: Array
(
    [files] => Array
        (
            [name] => 
            [full_path] => 
            [type] => 
            [tmp_name] => 
            [error] => 4
            [size] => 0
        )

    [pdf] => Array
        (
            [name] => 
            [full_path] => 
            [type] => 
            [tmp_name] => 
            [error] => 4
            [size] => 0
        )

)

repetitivo_fechas exists: YES
repetitivo_fechas value: ["2025-09-04","2025-09-05","2025-09-06"]
repetitivo_fechas empty check: NOT EMPTY
After validation - error: FALSE
Category: Circular
Starting database operations...
PDF filename: NULL
Processing repetitive dates...
Decoded dates: Array
(
    [0] => 2025-09-04
    [1] => 2025-09-05
    [2] => 2025-09-06
)

SQL: INSERT INTO memos (repetitivo_fechas, contenido, titulo, color, pdf) 
								VALUES (?, ?, ?, ?, ?)
Params: Array
(
    [0] => ["2025-09-04","2025-09-05","2025-09-06"]
    [1] => <p>fff</p>
    [2] => fff
    [3] => Circular
    [4] => 
)

Execute result: SUCCESS
Affected rows: 1
Transaction committed successfully
Final response: {"msg":"El mensaje se guard\u00f3 con \u00e9xito.","error":false,"focus":""}
=== END DEBUG ===

=== SAVE RECORD DEBUG ===
POST data: Array
(
    [id] => 515
    [titulo] => fff
    [fecha] => 07/09/2025
    [hora_inicial] => 
    [fecha_exp] => 08/09/2025
    [hora_exp] => 
    [color] => Circular
    [repeat_dates] => 04/09/2025,05/09/2025,06/09/2025
    [mensaje] => <p>fff</p>
    [fecha_datetime] => 2025-09-07 00:00:00
    [fecha_exp_datetime] => 2025-09-08 23:59:00
    [todo_el_dia] => 1
)

FILES data: Array
(
    [files] => Array
        (
            [name] => 
            [full_path] => 
            [type] => 
            [tmp_name] => 
            [error] => 4
            [size] => 0
        )

    [pdf] => Array
        (
            [name] => 
            [full_path] => 
            [type] => 
            [tmp_name] => 
            [error] => 4
            [size] => 0
        )

)

repetitivo_fechas exists: NO
After validation - error: FALSE
Category: Circular
Starting database operations...
PDF filename: NULL
Processing regular dates...
Processed fecha: 2025-09-07 00:00:00
Processed fechaExp: 2025-09-08 23:59:59
SQL: INSERT INTO memos (fecha, fechaExp, contenido, titulo, color, pdf)
							VALUES (?, ?, ?, ?, ?, ?)
Params: Array
(
    [0] => 2025-09-07 00:00:00
    [1] => 2025-09-08 23:59:59
    [2] => <p>fff</p>
    [3] => fff
    [4] => Circular
    [5] => 
)

Execute result: SUCCESS
Affected rows: 1
Transaction committed successfully
Final response: {"msg":"El mensaje se guard\u00f3 con \u00e9xito.","error":false,"focus":""}
=== END DEBUG ===

=== SAVE RECORD DEBUG ===
POST data: Array
(
    [titulo] => fff
    [fecha] => 01/09/2025
    [hora_inicial] => 
    [fecha_exp] => 02/09/2025
    [hora_exp] => 
    [color] => Circular
    [repeat_dates] => 
    [mensaje] => <p>fff</p>
    [fecha_datetime] => 2025-09-01 00:00:00
    [fecha_exp_datetime] => 2025-09-02 23:59:00
    [todo_el_dia] => 1
)

FILES data: Array
(
    [files] => Array
        (
            [name] => 
            [full_path] => 
            [type] => 
            [tmp_name] => 
            [error] => 4
            [size] => 0
        )

    [pdf] => Array
        (
            [name] => 
            [full_path] => 
            [type] => 
            [tmp_name] => 
            [error] => 4
            [size] => 0
        )

)

repetitivo_fechas exists: NO
After validation - error: FALSE
Category: Circular
Starting database operations...
PDF filename: NULL
Processing regular dates...
Processed fecha: 2025-09-01 00:00:00
Processed fechaExp: 2025-09-02 23:59:59
SQL: INSERT INTO memos (fecha, fechaExp, contenido, titulo, color, pdf)
							VALUES (?, ?, ?, ?, ?, ?)
Params: Array
(
    [0] => 2025-09-01 00:00:00
    [1] => 2025-09-02 23:59:59
    [2] => <p>fff</p>
    [3] => fff
    [4] => Circular
    [5] => 
)

Execute result: SUCCESS
Affected rows: 1
Transaction committed successfully
Final response: {"msg":"El mensaje se guard\u00f3 con \u00e9xito.","error":false,"focus":""}
=== END DEBUG ===

=== SAVE RECORD DEBUG ===
POST data: Array
(
    [id] => 517
    [titulo] => fff
    [color] => Circular
    [repetitivo] => 1
    [repeat_dates] => 
    [mensaje] => <p>fff</p>
    [colorHex] => #9C27B0
    [repetitivo_fechas] => ["2025-09-03"]
    [todo_el_dia] => 1
)

FILES data: Array
(
    [files] => Array
        (
            [name] => 
            [full_path] => 
            [type] => 
            [tmp_name] => 
            [error] => 4
            [size] => 0
        )

    [pdf] => Array
        (
            [name] => 
            [full_path] => 
            [type] => 
            [tmp_name] => 
            [error] => 4
            [size] => 0
        )

)

repetitivo_fechas exists: YES
repetitivo_fechas value: ["2025-09-03"]
repetitivo_fechas empty check: NOT EMPTY
After validation - error: FALSE
Category: Circular
Starting database operations...
PDF filename: NULL
Processing repetitive dates...
Decoded dates: Array
(
    [0] => 2025-09-03
)

SQL: INSERT INTO memos (repetitivo_fechas, contenido, titulo, color, pdf) 
								VALUES (?, ?, ?, ?, ?)
Params: Array
(
    [0] => ["2025-09-03"]
    [1] => <p>fff</p>
    [2] => fff
    [3] => Circular
    [4] => 
)

Execute result: SUCCESS
Affected rows: 1
Transaction committed successfully
Final response: {"msg":"El mensaje se guard\u00f3 con \u00e9xito.","error":false,"focus":""}
=== END DEBUG ===

=== SAVE RECORD DEBUG ===
POST data: Array
(
    [id] => 518
    [titulo] => fff
    [color] => Circular
    [repetitivo] => 1
    [repeat_dates] => 
    [mensaje] => <p>fff</p>
    [colorHex] => #9C27B0
    [repetitivo_fechas] => ["2025-09-03"]
    [todo_el_dia] => 1
)

FILES data: Array
(
    [files] => Array
        (
            [name] => 
            [full_path] => 
            [type] => 
            [tmp_name] => 
            [error] => 4
            [size] => 0
        )

    [pdf] => Array
        (
            [name] => 
            [full_path] => 
            [type] => 
            [tmp_name] => 
            [error] => 4
            [size] => 0
        )

)

repetitivo_fechas exists: YES
repetitivo_fechas value: ["2025-09-03"]
repetitivo_fechas empty check: NOT EMPTY
After validation - error: FALSE
Category: Circular
Starting database operations...
PDF filename: NULL
Processing repetitive dates...
Decoded dates: Array
(
    [0] => 2025-09-03
)

SQL: INSERT INTO memos (repetitivo_fechas, contenido, titulo, color, pdf) 
								VALUES (?, ?, ?, ?, ?)
Params: Array
(
    [0] => ["2025-09-03"]
    [1] => <p>fff</p>
    [2] => fff
    [3] => Circular
    [4] => 
)

Execute result: SUCCESS
Affected rows: 1
Transaction committed successfully
Final response: {"msg":"El mensaje se guard\u00f3 con \u00e9xito.","error":false,"focus":""}
=== END DEBUG ===

=== SAVE RECORD DEBUG ===
POST data: Array
(
    [id] => 519
    [titulo] => fff
    [hora_inicial] => 
    [hora_exp] => 
    [color] => Circular
    [repetitivo] => 1
    [repeat_dates] => 02/09/2025,03/09/2025,04/09/2025
    [mensaje] => <p>fff</p>
    [repetitivo_fechas] => ["2025-09-02","2025-09-03","2025-09-04"]
    [todo_el_dia] => 1
)

FILES data: Array
(
    [files] => Array
        (
            [name] => 
            [full_path] => 
            [type] => 
            [tmp_name] => 
            [error] => 4
            [size] => 0
        )

    [pdf] => Array
        (
            [name] => 
            [full_path] => 
            [type] => 
            [tmp_name] => 
            [error] => 4
            [size] => 0
        )

)

repetitivo_fechas exists: YES
repetitivo_fechas value: ["2025-09-02","2025-09-03","2025-09-04"]
repetitivo_fechas empty check: NOT EMPTY
After validation - error: FALSE
Category: Circular
Starting database operations...
PDF filename: NULL
Processing repetitive dates...
Decoded dates: Array
(
    [0] => 2025-09-02
    [1] => 2025-09-03
    [2] => 2025-09-04
)

SQL: INSERT INTO memos (repetitivo_fechas, contenido, titulo, color, pdf) 
								VALUES (?, ?, ?, ?, ?)
Params: Array
(
    [0] => ["2025-09-02","2025-09-03","2025-09-04"]
    [1] => <p>fff</p>
    [2] => fff
    [3] => Circular
    [4] => 
)

Execute result: SUCCESS
Affected rows: 1
Transaction committed successfully
Final response: {"msg":"El mensaje se guard\u00f3 con \u00e9xito.","error":false,"focus":""}
=== END DEBUG ===

=== SAVE RECORD DEBUG ===
POST data: Array
(
    [titulo] => aaa
    [fecha] => 01/09/2025
    [hora_inicial] => 
    [fecha_exp] => 02/09/2025
    [hora_exp] => 
    [color] => Otros
    [repeat_dates] => 
    [mensaje] => <p>aaa</p>
    [fecha_datetime] => 2025-09-01 00:00:00
    [fecha_exp_datetime] => 2025-09-02 23:59:00
    [todo_el_dia] => 1
)

FILES data: Array
(
    [files] => Array
        (
            [name] => 
            [full_path] => 
            [type] => 
            [tmp_name] => 
            [error] => 4
            [size] => 0
        )

    [pdf] => Array
        (
            [name] => 
            [full_path] => 
            [type] => 
            [tmp_name] => 
            [error] => 4
            [size] => 0
        )

)

repetitivo_fechas exists: NO
After validation - error: FALSE
Category: Otros
Starting database operations...
PDF filename: NULL
Processing regular dates...
Processed fecha: 2025-09-01 00:00:00
Processed fechaExp: 2025-09-02 23:59:59
SQL: INSERT INTO memos (fecha, fechaExp, contenido, titulo, color, pdf)
							VALUES (?, ?, ?, ?, ?, ?)
Params: Array
(
    [0] => 2025-09-01 00:00:00
    [1] => 2025-09-02 23:59:59
    [2] => <p>aaa</p>
    [3] => aaa
    [4] => Otros
    [5] => 
)

Execute result: SUCCESS
Affected rows: 1
Transaction committed successfully
Final response: {"msg":"El mensaje se guard\u00f3 con \u00e9xito.","error":false,"focus":""}
=== END DEBUG ===

=== SAVE RECORD DEBUG ===
POST data: Array
(
    [id] => 521
    [titulo] => aaa
    [hora_inicial] => 00:00
    [hora_exp] => 23:59
    [color] => Otros
    [repetitivo] => 1
    [repeat_dates] => 03/09/2025,04/09/2025,05/09/2025
    [mensaje] => <p>aaa</p>
    [repetitivo_fechas] => ["2025-09-03","2025-09-04","2025-09-05"]
    [todo_el_dia] => 1
)

FILES data: Array
(
    [files] => Array
        (
            [name] => 
            [full_path] => 
            [type] => 
            [tmp_name] => 
            [error] => 4
            [size] => 0
        )

    [pdf] => Array
        (
            [name] => 
            [full_path] => 
            [type] => 
            [tmp_name] => 
            [error] => 4
            [size] => 0
        )

)

repetitivo_fechas exists: YES
repetitivo_fechas value: ["2025-09-03","2025-09-04","2025-09-05"]
repetitivo_fechas empty check: NOT EMPTY
After validation - error: FALSE
Category: Otros
Starting database operations...
PDF filename: NULL
Processing repetitive dates...
Decoded dates: Array
(
    [0] => 2025-09-03
    [1] => 2025-09-04
    [2] => 2025-09-05
)

SQL: INSERT INTO memos (repetitivo_fechas, contenido, titulo, color, pdf) 
								VALUES (?, ?, ?, ?, ?)
Params: Array
(
    [0] => ["2025-09-03","2025-09-04","2025-09-05"]
    [1] => <p>aaa</p>
    [2] => aaa
    [3] => Otros
    [4] => 
)

Execute result: SUCCESS
Affected rows: 1
Transaction committed successfully
Final response: {"msg":"El mensaje se guard\u00f3 con \u00e9xito.","error":false,"focus":""}
=== END DEBUG ===

=== SAVE RECORD DEBUG ===
POST data: Array
(
    [id] => 523
    [titulo] => Prueba 73
    [hora_inicial] => 05:14
    [hora_exp] => 20:20
    [color] => Importantes
    [repetitivo] => 1
    [repeat_dates] => 01/09/2025,02/09/2025,03/09/2025
    [mensaje] => <p>Prueba hehe</p>
    [repetitivo_fechas] => ["2025-09-01","2025-09-02","2025-09-03"]
    [todo_el_dia] => 1
)

FILES data: Array
(
    [files] => Array
        (
            [name] => 
            [full_path] => 
            [type] => 
            [tmp_name] => 
            [error] => 4
            [size] => 0
        )

    [pdf] => Array
        (
            [name] => 
            [full_path] => 
            [type] => 
            [tmp_name] => 
            [error] => 4
            [size] => 0
        )

)

repetitivo_fechas exists: YES
repetitivo_fechas value: ["2025-09-01","2025-09-02","2025-09-03"]
repetitivo_fechas empty check: NOT EMPTY
After validation - error: FALSE
Category: Importantes
Starting database operations...
PDF filename: NULL
Processing repetitive dates...
Decoded dates: Array
(
    [0] => 2025-09-01
    [1] => 2025-09-02
    [2] => 2025-09-03
)

SQL: UPDATE memos SET repetitivo_fechas = ?, contenido = ?, titulo = ?, color = ?, pdf = ?, fecha = NULL, fechaExp = NULL WHERE id = ?
Params: Array
(
    [0] => ["2025-09-01","2025-09-02","2025-09-03"]
    [1] => <p>Prueba hehe</p>
    [2] => Prueba 73
    [3] => Importantes
    [4] => 
    [5] => 523
)

Execute result: SUCCESS
Affected rows: 1
Transaction committed successfully
Final response: {"msg":"El mensaje se guard\u00f3 con \u00e9xito.","error":false,"focus":""}
=== END DEBUG ===

=== SAVE RECORD DEBUG ===
POST data: Array
(
    [id] => 523
    [titulo] => Prueba 73
    [fecha] => 02/09/2025
    [hora_inicial] => 
    [fecha_exp] => 03/09/2025
    [hora_exp] => 
    [color] => Importantes
    [repeat_dates] => 01/09/2025,02/09/2025,03/09/2025
    [mensaje] => <p>Prueba hehe</p>
    [fecha_datetime] => 2025-09-02 00:00:00
    [fecha_exp_datetime] => 2025-09-03 23:59:00
    [todo_el_dia] => 1
)

FILES data: Array
(
    [files] => Array
        (
            [name] => 
            [full_path] => 
            [type] => 
            [tmp_name] => 
            [error] => 4
            [size] => 0
        )

    [pdf] => Array
        (
            [name] => 
            [full_path] => 
            [type] => 
            [tmp_name] => 
            [error] => 4
            [size] => 0
        )

)

repetitivo_fechas exists: NO
After validation - error: FALSE
Category: Importantes
Starting database operations...
PDF filename: NULL
Processing regular dates...
Processed fecha: 2025-09-02 00:00:00
Processed fechaExp: 2025-09-03 23:59:59
SQL: UPDATE memos SET fecha = ?, fechaExp = ?, contenido = ?, titulo = ?, color = ?, pdf = ?, repetitivo_fechas = NULL WHERE id = ?
Params: Array
(
    [0] => 2025-09-02 00:00:00
    [1] => 2025-09-03 23:59:59
    [2] => <p>Prueba hehe</p>
    [3] => Prueba 73
    [4] => Importantes
    [5] => 
    [6] => 523
)

Execute result: SUCCESS
Affected rows: 1
Transaction committed successfully
Final response: {"msg":"El mensaje se guard\u00f3 con \u00e9xito.","error":false,"focus":""}
=== END DEBUG ===

=== SAVE RECORD DEBUG ===
POST data: Array
(
    [id] => 523
    [titulo] => Prueba 73
    [hora_inicial] => 00:00
    [hora_exp] => 23:59
    [color] => Importantes
    [repetitivo] => 1
    [repeat_dates] => 03/09/2025,04/09/2025,05/09/2025
    [mensaje] => <p>Prueba hehe</p>
    [repetitivo_fechas] => ["2025-09-03","2025-09-04","2025-09-05"]
    [todo_el_dia] => 1
)

FILES data: Array
(
    [files] => Array
        (
            [name] => 
            [full_path] => 
            [type] => 
            [tmp_name] => 
            [error] => 4
            [size] => 0
        )

    [pdf] => Array
        (
            [name] => 
            [full_path] => 
            [type] => 
            [tmp_name] => 
            [error] => 4
            [size] => 0
        )

)

repetitivo_fechas exists: YES
repetitivo_fechas value: ["2025-09-03","2025-09-04","2025-09-05"]
repetitivo_fechas empty check: NOT EMPTY
After validation - error: FALSE
Category: Importantes
Starting database operations...
PDF filename: NULL
Processing repetitive dates...
Decoded dates: Array
(
    [0] => 2025-09-03
    [1] => 2025-09-04
    [2] => 2025-09-05
)

SQL: UPDATE memos SET repetitivo_fechas = ?, contenido = ?, titulo = ?, color = ?, pdf = ?, fecha = NULL, fechaExp = NULL WHERE id = ?
Params: Array
(
    [0] => ["2025-09-03","2025-09-04","2025-09-05"]
    [1] => <p>Prueba hehe</p>
    [2] => Prueba 73
    [3] => Importantes
    [4] => 
    [5] => 523
)

Execute result: SUCCESS
Affected rows: 1
Transaction committed successfully
Final response: {"msg":"El mensaje se guard\u00f3 con \u00e9xito.","error":false,"focus":""}
=== END DEBUG ===

=== SAVE RECORD DEBUG ===
POST data: Array
(
    [id] => 523
    [titulo] => Prueba 73
    [hora_inicial] => 
    [hora_exp] => 
    [color] => Importantes
    [repetitivo] => 1
    [repeat_dates] => 03/09/2025,04/09/2025,05/09/2025
    [mensaje] => <p>Prueba hehe</p>
    [repetitivo_fechas] => ["2025-09-03","2025-09-04","2025-09-05"]
    [todo_el_dia] => 1
)

FILES data: Array
(
    [files] => Array
        (
            [name] => 
            [full_path] => 
            [type] => 
            [tmp_name] => 
            [error] => 4
            [size] => 0
        )

    [pdf] => Array
        (
            [name] => 
            [full_path] => 
            [type] => 
            [tmp_name] => 
            [error] => 4
            [size] => 0
        )

)

repetitivo_fechas exists: YES
repetitivo_fechas value: ["2025-09-03","2025-09-04","2025-09-05"]
repetitivo_fechas empty check: NOT EMPTY
After validation - error: FALSE
Category: Importantes
Starting database operations...
PDF filename: NULL
Processing repetitive dates...
Decoded dates: Array
(
    [0] => 2025-09-03
    [1] => 2025-09-04
    [2] => 2025-09-05
)

SQL: UPDATE memos SET repetitivo_fechas = ?, contenido = ?, titulo = ?, color = ?, pdf = ?, fecha = NULL, fechaExp = NULL WHERE id = ?
Params: Array
(
    [0] => ["2025-09-03","2025-09-04","2025-09-05"]
    [1] => <p>Prueba hehe</p>
    [2] => Prueba 73
    [3] => Importantes
    [4] => 
    [5] => 523
)

Execute result: SUCCESS
Affected rows: 0
Transaction committed successfully
Final response: {"msg":"El mensaje se guard\u00f3 con \u00e9xito.","error":false,"focus":""}
=== END DEBUG ===

=== SAVE RECORD DEBUG ===
POST data: Array
(
    [id] => 523
    [titulo] => Prueba 73
    [hora_inicial] => 
    [hora_exp] => 
    [color] => Importantes
    [repetitivo] => 1
    [repeat_dates] => 03/09/2025,04/09/2025,05/09/2025
    [mensaje] => <p>Prueba hehe</p>
    [repetitivo_fechas] => ["2025-09-03","2025-09-04","2025-09-05"]
    [todo_el_dia] => 1
)

FILES data: Array
(
    [files] => Array
        (
            [name] => 
            [full_path] => 
            [type] => 
            [tmp_name] => 
            [error] => 4
            [size] => 0
        )

    [pdf] => Array
        (
            [name] => 
            [full_path] => 
            [type] => 
            [tmp_name] => 
            [error] => 4
            [size] => 0
        )

)

repetitivo_fechas exists: YES
repetitivo_fechas value: ["2025-09-03","2025-09-04","2025-09-05"]
repetitivo_fechas empty check: NOT EMPTY
After validation - error: FALSE
Category: Importantes
Starting database operations...
PDF filename: NULL
Processing repetitive dates...
Decoded dates: Array
(
    [0] => 2025-09-03
    [1] => 2025-09-04
    [2] => 2025-09-05
)

SQL: UPDATE memos SET repetitivo_fechas = ?, contenido = ?, titulo = ?, color = ?, pdf = ?, fecha = NULL, fechaExp = NULL WHERE id = ?
Params: Array
(
    [0] => ["2025-09-03","2025-09-04","2025-09-05"]
    [1] => <p>Prueba hehe</p>
    [2] => Prueba 73
    [3] => Importantes
    [4] => 
    [5] => 523
)

Execute result: SUCCESS
Affected rows: 0
Transaction committed successfully
Final response: {"msg":"El mensaje se guard\u00f3 con \u00e9xito.","error":false,"focus":""}
=== END DEBUG ===

=== SAVE RECORD DEBUG ===
POST data: Array
(
    [titulo] => pppppss
    [fecha] => 02/09/2025
    [hora_inicial] => 
    [fecha_exp] => 04/09/2025
    [hora_exp] => 
    [color] => Avisos temporales
    [repeat_dates] => 
    [mensaje] => <p>ffff</p>
    [fecha_datetime] => 2025-09-02 00:00:00
    [fecha_exp_datetime] => 2025-09-04 23:59:00
    [todo_el_dia] => 1
)

FILES data: Array
(
    [files] => Array
        (
            [name] => 
            [full_path] => 
            [type] => 
            [tmp_name] => 
            [error] => 4
            [size] => 0
        )

    [pdf] => Array
        (
            [name] => 
            [full_path] => 
            [type] => 
            [tmp_name] => 
            [error] => 4
            [size] => 0
        )

)

repetitivo_fechas exists: NO
After validation - error: FALSE
Category: Avisos temporales
Starting database operations...
PDF filename: NULL
Processing regular dates...
Processed fecha: 2025-09-02 00:00:00
Processed fechaExp: 2025-09-04 23:59:59
SQL: INSERT INTO memos (fecha, fechaExp, contenido, titulo, color, pdf) VALUES (?, ?, ?, ?, ?, ?)
Params: Array
(
    [0] => 2025-09-02 00:00:00
    [1] => 2025-09-04 23:59:59
    [2] => <p>ffff</p>
    [3] => pppppss
    [4] => Avisos temporales
    [5] => 
)

Execute result: SUCCESS
Affected rows: 1
Transaction committed successfully
Final response: {"msg":"El mensaje se guard\u00f3 con \u00e9xito.","error":false,"focus":""}
=== END DEBUG ===

=== SAVE RECORD DEBUG ===
POST data: Array
(
    [titulo] => 
    [fecha] => 03/09/2025
    [hora_inicial] => 
    [fecha_exp] => 
    [hora_exp] => 
    [color] => Renovacion
    [repeat_dates] => 
    [mensaje] => <p>cccc</p>
    [fecha_datetime] => 2025-09-03 00:00:00
    [todo_el_dia] => 1
)

FILES data: Array
(
    [files] => Array
        (
            [name] => 
            [full_path] => 
            [type] => 
            [tmp_name] => 
            [error] => 4
            [size] => 0
        )

    [pdf] => Array
        (
            [name] => 
            [full_path] => 
            [type] => 
            [tmp_name] => 
            [error] => 4
            [size] => 0
        )

)

repetitivo_fechas exists: NO
Validation error: El campo titulo es obligatorio. for field: titulo
After validation - error: TRUE
Category: Renovacion
Skipping database operations due to validation error
Final response: {"msg":"El campo titulo es obligatorio.","error":true,"focus":"titulo"}
=== END DEBUG ===

=== SAVE RECORD DEBUG ===
POST data: Array
(
    [titulo] => dcdcdc
    [fecha] => 03/09/2025
    [hora_inicial] => 
    [fecha_exp] => 
    [hora_exp] => 
    [color] => Renovacion
    [repeat_dates] => 
    [mensaje] => <p>cccc</p>
    [fecha_datetime] => 2025-09-03 00:00:00
    [todo_el_dia] => 1
)

FILES data: Array
(
    [files] => Array
        (
            [name] => 
            [full_path] => 
            [type] => 
            [tmp_name] => 
            [error] => 4
            [size] => 0
        )

    [pdf] => Array
        (
            [name] => 
            [full_path] => 
            [type] => 
            [tmp_name] => 
            [error] => 4
            [size] => 0
        )

)

repetitivo_fechas exists: NO
After validation - error: FALSE
Category: Renovacion
Starting database operations...
PDF filename: NULL
Processing regular dates...
Processed fecha: 2025-09-03 00:00:00
Processed fechaExp: NULL
SQL: INSERT INTO memos (fecha, fechaExp, contenido, titulo, color, pdf) VALUES (?, ?, ?, ?, ?, ?)
Params: Array
(
    [0] => 2025-09-03 00:00:00
    [1] => 
    [2] => <p>cccc</p>
    [3] => dcdcdc
    [4] => Renovacion
    [5] => 
)

Execute result: SUCCESS
Affected rows: 1
Transaction committed successfully
Final response: {"msg":"El mensaje se guard\u00f3 con \u00e9xito.","error":false,"focus":""}
=== END DEBUG ===

=== SAVE RECORD DEBUG ===
POST data: Array
(
    [titulo] => xxxxxx
    [hora_inicial] => 
    [hora_exp] => 
    [color] => Cobranza
    [repetitivo] => 1
    [repeat_dates] => 04/09/2025,05/09/2025,06/09/2025
    [mensaje] => <p>xxxxxxx</p>
    [repetitivo_fechas] => ["2025-09-04 00:00:00","2025-09-05 00:00:00","2025-09-06 00:00:00"]
    [todo_el_dia] => 1
)

FILES data: Array
(
    [files] => Array
        (
            [name] => 
            [full_path] => 
            [type] => 
            [tmp_name] => 
            [error] => 4
            [size] => 0
        )

    [pdf] => Array
        (
            [name] => 
            [full_path] => 
            [type] => 
            [tmp_name] => 
            [error] => 4
            [size] => 0
        )

)

repetitivo_fechas exists: YES
repetitivo_fechas value: ["2025-09-04 00:00:00","2025-09-05 00:00:00","2025-09-06 00:00:00"]
repetitivo_fechas empty check: NOT EMPTY
After validation - error: FALSE
Category: Cobranza
Starting database operations...
PDF filename: NULL
Processing repetitive dates...
Decoded dates: Array
(
    [0] => 2025-09-04 00:00:00
    [1] => 2025-09-05 00:00:00
    [2] => 2025-09-06 00:00:00
)

SQL: INSERT INTO memos (repetitivo_fechas, contenido, titulo, color, pdf) VALUES (?, ?, ?, ?, ?)
Params: Array
(
    [0] => ["2025-09-04 00:00:00","2025-09-05 00:00:00","2025-09-06 00:00:00"]
    [1] => <p>xxxxxxx</p>
    [2] => xxxxxx
    [3] => Cobranza
    [4] => 
)

Execute result: SUCCESS
Affected rows: 1
Transaction committed successfully
Final response: {"msg":"El mensaje se guard\u00f3 con \u00e9xito.","error":false,"focus":""}
=== END DEBUG ===

=== SAVE RECORD DEBUG ===
POST data: Array
(
    [titulo] => Prueba 1
    [hora_inicial] => 
    [hora_exp] => 
    [color] => Avisos temporales
    [repetitivo] => 1
    [repeat_dates] => 02/09/2025,09/09/2025,16/09/2025,23/09/2025,30/09/2025
    [mensaje] => <p>Mensaje de Prueba 1</p><p><br></p>
    [repetitivo_fechas] => ["2025-09-02 00:00:00","2025-09-09 00:00:00","2025-09-16 00:00:00","2025-09-23 00:00:00","2025-09-30 00:00:00"]
    [todo_el_dia] => 1
)

FILES data: Array
(
    [files] => Array
        (
            [name] => 
            [full_path] => 
            [type] => 
            [tmp_name] => 
            [error] => 4
            [size] => 0
        )

    [pdf] => Array
        (
            [name] => 
            [full_path] => 
            [type] => 
            [tmp_name] => 
            [error] => 4
            [size] => 0
        )

)

repetitivo_fechas exists: YES
repetitivo_fechas value: ["2025-09-02 00:00:00","2025-09-09 00:00:00","2025-09-16 00:00:00","2025-09-23 00:00:00","2025-09-30 00:00:00"]
repetitivo_fechas empty check: NOT EMPTY
After validation - error: FALSE
Category: Avisos temporales
Starting database operations...
PDF filename: NULL
Processing repetitive dates...
Decoded dates: Array
(
    [0] => 2025-09-02 00:00:00
    [1] => 2025-09-09 00:00:00
    [2] => 2025-09-16 00:00:00
    [3] => 2025-09-23 00:00:00
    [4] => 2025-09-30 00:00:00
)

SQL: INSERT INTO memos (repetitivo_fechas, contenido, titulo, color, pdf) VALUES (?, ?, ?, ?, ?)
Params: Array
(
    [0] => ["2025-09-02 00:00:00","2025-09-09 00:00:00","2025-09-16 00:00:00","2025-09-23 00:00:00","2025-09-30 00:00:00"]
    [1] => <p>Mensaje de Prueba 1</p><p><br></p>
    [2] => Prueba 1
    [3] => Avisos temporales
    [4] => 
)

Execute result: SUCCESS
Affected rows: 1
Transaction committed successfully
Final response: {"msg":"El mensaje se guard\u00f3 con \u00e9xito.","error":false,"focus":""}
=== END DEBUG ===

=== SAVE RECORD DEBUG ===
POST data: Array
(
    [titulo] => Prueba 1
    [fecha] => 02/09/2025
    [hora_inicial] => 
    [fecha_exp] => 
    [hora_exp] => 
    [color] => Otros
    [repeat_dates] => 
    [mensaje] => <p>Mensaje de prueba 1</p><p><br></p>
    [fecha_datetime] => 2025-09-02 00:00:00
    [todo_el_dia] => 1
)

FILES data: Array
(
    [files] => Array
        (
            [name] => 
            [full_path] => 
            [type] => 
            [tmp_name] => 
            [error] => 4
            [size] => 0
        )

    [pdf] => Array
        (
            [name] => 
            [full_path] => 
            [type] => 
            [tmp_name] => 
            [error] => 4
            [size] => 0
        )

)

repetitivo_fechas exists: NO
After validation - error: FALSE
Category: Otros
Starting database operations...
PDF filename: NULL
Processing regular dates...
Processed fecha: 2025-09-02 00:00:00
Processed fechaExp: NULL
SQL: INSERT INTO memos (fecha, fechaExp, contenido, titulo, color, pdf) VALUES (?, ?, ?, ?, ?, ?)
Params: Array
(
    [0] => 2025-09-02 00:00:00
    [1] => 
    [2] => <p>Mensaje de prueba 1</p><p><br></p>
    [3] => Prueba 1
    [4] => Otros
    [5] => 
)

Execute result: SUCCESS
Affected rows: 1
Transaction committed successfully
Final response: {"msg":"El mensaje se guard\u00f3 con \u00e9xito.","error":false,"focus":""}
=== END DEBUG ===

=== SAVE RECORD DEBUG ===
POST data: Array
(
    [id] => 528
    [titulo] => Prueba 1
    [fecha] => 02/09/2025
    [hora_inicial] => 00:00
    [fecha_exp] => 
    [hora_exp] => 
    [color] => Vacaciones
    [repeat_dates] => 
    [mensaje] => <p>Mensaje de prueba 1</p><p><br></p>
    [fecha_datetime] => 2025-09-02 00:00:00
    [todo_el_dia] => 0
)

FILES data: Array
(
    [files] => Array
        (
            [name] => 
            [full_path] => 
            [type] => 
            [tmp_name] => 
            [error] => 4
            [size] => 0
        )

    [pdf] => Array
        (
            [name] => 
            [full_path] => 
            [type] => 
            [tmp_name] => 
            [error] => 4
            [size] => 0
        )

)

repetitivo_fechas exists: NO
After validation - error: FALSE
Category: Vacaciones
Starting database operations...
PDF filename: NULL
Processing regular dates...
Processed fecha: 2025-09-02 00:00:00
Processed fechaExp: NULL
SQL: UPDATE memos SET fecha = ?, fechaExp = ?, contenido = ?, titulo = ?, color = ?, pdf = ?, repetitivo_fechas = NULL WHERE id = ?
Params: Array
(
    [0] => 2025-09-02 00:00:00
    [1] => 
    [2] => <p>Mensaje de prueba 1</p><p><br></p>
    [3] => Prueba 1
    [4] => Vacaciones
    [5] => 
    [6] => 528
)

Execute result: SUCCESS
Affected rows: 1
Transaction committed successfully
Final response: {"msg":"El mensaje se guard\u00f3 con \u00e9xito.","error":false,"focus":""}
=== END DEBUG ===

=== SAVE RECORD DEBUG ===
POST data: Array
(
    [id] => 528
    [titulo] => Prueba 1
    [hora_inicial] => 00:00
    [hora_exp] => 
    [color] => Vacaciones
    [repetitivo] => 1
    [repeat_dates] => 02/09/2025,09/09/2025,16/09/2025,23/09/2025,30/09/2025
    [mensaje] => <p>Mensaje de prueba 1</p><p><br></p>
    [repetitivo_fechas] => ["2025-09-02","2025-09-09","2025-09-16","2025-09-23","2025-09-30"]
    [todo_el_dia] => 1
)

FILES data: Array
(
    [files] => Array
        (
            [name] => 
            [full_path] => 
            [type] => 
            [tmp_name] => 
            [error] => 4
            [size] => 0
        )

    [pdf] => Array
        (
            [name] => 
            [full_path] => 
            [type] => 
            [tmp_name] => 
            [error] => 4
            [size] => 0
        )

)

repetitivo_fechas exists: YES
repetitivo_fechas value: ["2025-09-02","2025-09-09","2025-09-16","2025-09-23","2025-09-30"]
repetitivo_fechas empty check: NOT EMPTY
After validation - error: FALSE
Category: Vacaciones
Starting database operations...
PDF filename: NULL
Processing repetitive dates...
Decoded dates: Array
(
    [0] => 2025-09-02
    [1] => 2025-09-09
    [2] => 2025-09-16
    [3] => 2025-09-23
    [4] => 2025-09-30
)

SQL: UPDATE memos SET repetitivo_fechas = ?, contenido = ?, titulo = ?, color = ?, pdf = ?, fecha = NULL, fechaExp = NULL WHERE id = ?
Params: Array
(
    [0] => ["2025-09-02","2025-09-09","2025-09-16","2025-09-23","2025-09-30"]
    [1] => <p>Mensaje de prueba 1</p><p><br></p>
    [2] => Prueba 1
    [3] => Vacaciones
    [4] => 
    [5] => 528
)

Execute result: SUCCESS
Affected rows: 1
Transaction committed successfully
Final response: {"msg":"El mensaje se guard\u00f3 con \u00e9xito.","error":false,"focus":""}
=== END DEBUG ===

=== SAVE RECORD DEBUG ===
POST data: Array
(
    [titulo] => Prueba 1
    [fecha] => 03/09/2025
    [hora_inicial] => 
    [fecha_exp] => 
    [hora_exp] => 
    [color] => Circular
    [repeat_dates] => 
    [mensaje] => <p>Mensaje de prueba 1</p>
    [fecha_datetime] => 2025-09-03 00:00:00
    [todo_el_dia] => 1
)

FILES data: Array
(
    [files] => Array
        (
            [name] => 
            [full_path] => 
            [type] => 
            [tmp_name] => 
            [error] => 4
            [size] => 0
        )

    [pdf] => Array
        (
            [name] => 
            [full_path] => 
            [type] => 
            [tmp_name] => 
            [error] => 4
            [size] => 0
        )

)

repetitivo_fechas exists: NO
After validation - error: FALSE
Category: Circular
Starting database operations...
PDF filename: NULL
Processing regular dates...
Processed fecha: 2025-09-03 00:00:00
Processed fechaExp: NULL
SQL: INSERT INTO memos (fecha, fechaExp, contenido, titulo, color, pdf) VALUES (?, ?, ?, ?, ?, ?)
Params: Array
(
    [0] => 2025-09-03 00:00:00
    [1] => 
    [2] => <p>Mensaje de prueba 1</p>
    [3] => Prueba 1
    [4] => Circular
    [5] => 
)

Execute result: SUCCESS
Affected rows: 1
Transaction committed successfully
Final response: {"msg":"El mensaje se guard\u00f3 con \u00e9xito.","error":false,"focus":""}
=== END DEBUG ===

=== SAVE RECORD DEBUG ===
POST data: Array
(
    [id] => 529
    [titulo] => Prueba 1
    [hora_inicial] => 00:00
    [hora_exp] => 
    [color] => Vacaciones
    [repetitivo] => 1
    [repeat_dates] => 02/09/2025,09/09/2025,16/09/2025,23/09/2025,30/09/2025
    [mensaje] => Prueba 1 ahora es repetitivo
    [repetitivo_fechas] => ["2025-09-02","2025-09-09","2025-09-16","2025-09-23","2025-09-30"]
    [todo_el_dia] => 1
)

FILES data: Array
(
    [files] => Array
        (
            [name] => 
            [full_path] => 
            [type] => 
            [tmp_name] => 
            [error] => 4
            [size] => 0
        )

    [pdf] => Array
        (
            [name] => 
            [full_path] => 
            [type] => 
            [tmp_name] => 
            [error] => 4
            [size] => 0
        )

)

repetitivo_fechas exists: YES
repetitivo_fechas value: ["2025-09-02","2025-09-09","2025-09-16","2025-09-23","2025-09-30"]
repetitivo_fechas empty check: NOT EMPTY
After validation - error: FALSE
Category: Vacaciones
Starting database operations...
PDF filename: NULL
Processing repetitive dates...
Decoded dates: Array
(
    [0] => 2025-09-02
    [1] => 2025-09-09
    [2] => 2025-09-16
    [3] => 2025-09-23
    [4] => 2025-09-30
)

SQL: UPDATE memos SET repetitivo_fechas = ?, contenido = ?, titulo = ?, color = ?, pdf = ?, fecha = NULL, fechaExp = NULL WHERE id = ?
Params: Array
(
    [0] => ["2025-09-02","2025-09-09","2025-09-16","2025-09-23","2025-09-30"]
    [1] => Prueba 1 ahora es repetitivo
    [2] => Prueba 1
    [3] => Vacaciones
    [4] => 
    [5] => 529
)

Execute result: SUCCESS
Affected rows: 1
Transaction committed successfully
Final response: {"msg":"El mensaje se guard\u00f3 con \u00e9xito.","error":false,"focus":""}
=== END DEBUG ===

=== SAVE RECORD DEBUG ===
POST data: Array
(
    [id] => 529
    [titulo] => Prueba 1
    [fecha] => 02/09/2025
    [hora_inicial] => 
    [fecha_exp] => 05/09/2025
    [hora_exp] => 
    [color] => Renovacion
    [repeat_dates] => 02/09/2025,09/09/2025,16/09/2025,23/09/2025,30/09/2025
    [mensaje] => Prueba 1 ahora es repetitivo
    [fecha_datetime] => 2025-09-02 00:00:00
    [fecha_exp_datetime] => 2025-09-05 23:59:00
    [todo_el_dia] => 1
)

FILES data: Array
(
    [files] => Array
        (
            [name] => 
            [full_path] => 
            [type] => 
            [tmp_name] => 
            [error] => 4
            [size] => 0
        )

    [pdf] => Array
        (
            [name] => 
            [full_path] => 
            [type] => 
            [tmp_name] => 
            [error] => 4
            [size] => 0
        )

)

repetitivo_fechas exists: NO
After validation - error: FALSE
Category: Renovacion
Starting database operations...
PDF filename: NULL
Processing regular dates...
Processed fecha: 2025-09-02 00:00:00
Processed fechaExp: 2025-09-05 23:59:59
SQL: UPDATE memos SET fecha = ?, fechaExp = ?, contenido = ?, titulo = ?, color = ?, pdf = ?, repetitivo_fechas = NULL WHERE id = ?
Params: Array
(
    [0] => 2025-09-02 00:00:00
    [1] => 2025-09-05 23:59:59
    [2] => Prueba 1 ahora es repetitivo
    [3] => Prueba 1
    [4] => Renovacion
    [5] => 
    [6] => 529
)

Execute result: SUCCESS
Affected rows: 1
Transaction committed successfully
Final response: {"msg":"El mensaje se guard\u00f3 con \u00e9xito.","error":false,"focus":""}
=== END DEBUG ===

=== SAVE RECORD DEBUG ===
POST data: Array
(
    [titulo] => Prueba 1
    [hora_inicial] => 09:30
    [hora_exp] => 22:40
    [color] => Otros
    [repetitivo] => 1
    [repeat_dates] => 03/09/2025,10/09/2025,17/09/2025,24/09/2025
    [mensaje] => <p>Texto prueba 1</p>
    [repetitivo_fechas] => ["2025-09-03 00:00:00","2025-09-10 00:00:00","2025-09-17 00:00:00","2025-09-24 00:00:00"]
    [todo_el_dia] => 0
)

FILES data: Array
(
    [files] => Array
        (
            [name] => 
            [full_path] => 
            [type] => 
            [tmp_name] => 
            [error] => 4
            [size] => 0
        )

    [pdf] => Array
        (
            [name] => Optativa Practica - Fase 2.docx.pdf
            [full_path] => Optativa Practica - Fase 2.docx.pdf
            [type] => application/pdf
            [tmp_name] => C:\xampp\tmp\php1459.tmp
            [error] => 0
            [size] => 458612
        )

)

repetitivo_fechas exists: YES
repetitivo_fechas value: ["2025-09-03 00:00:00","2025-09-10 00:00:00","2025-09-17 00:00:00","2025-09-24 00:00:00"]
repetitivo_fechas empty check: NOT EMPTY
After validation - error: FALSE
Category: Otros
Starting database operations...
PDF filename: 68b855710d61c.pdf
Processing repetitive dates...
Decoded dates: Array
(
    [0] => 2025-09-03 00:00:00
    [1] => 2025-09-10 00:00:00
    [2] => 2025-09-17 00:00:00
    [3] => 2025-09-24 00:00:00
)

SQL: INSERT INTO memos (repetitivo_fechas, contenido, titulo, color, pdf) VALUES (?, ?, ?, ?, ?)
Params: Array
(
    [0] => ["2025-09-03 00:00:00","2025-09-10 00:00:00","2025-09-17 00:00:00","2025-09-24 00:00:00"]
    [1] => <p>Texto prueba 1</p>
    [2] => Prueba 1
    [3] => Otros
    [4] => 68b855710d61c.pdf
)

Execute result: SUCCESS
Affected rows: 1
Transaction committed successfully
Final response: {"msg":"El mensaje se guard\u00f3 con \u00e9xito.","error":false,"focus":""}
=== END DEBUG ===

=== SAVE RECORD DEBUG ===
POST data: Array
(
    [titulo] => Prueba 1
    [fecha] => 03/09/2025
    [hora_inicial] => 
    [fecha_exp] => 05/09/2025
    [hora_exp] => 
    [color] => Importantes
    [repeat_dates] => 
    [mensaje] => <p>Texto prueba 1</p>
    [fecha_datetime] => 2025-09-03 00:00:00
    [fecha_exp_datetime] => 2025-09-05 23:59:00
    [todo_el_dia] => 1
)

FILES data: Array
(
    [files] => Array
        (
            [name] => 
            [full_path] => 
            [type] => 
            [tmp_name] => 
            [error] => 4
            [size] => 0
        )

    [pdf] => Array
        (
            [name] => 
            [full_path] => 
            [type] => 
            [tmp_name] => 
            [error] => 4
            [size] => 0
        )

)

repetitivo_fechas exists: NO
After validation - error: FALSE
Category: Importantes
Starting database operations...
PDF filename: NULL
Processing regular dates...
Processed fecha: 2025-09-03 00:00:00
Processed fechaExp: 2025-09-05 23:59:59
SQL: INSERT INTO memos (fecha, fechaExp, contenido, titulo, color, pdf) VALUES (?, ?, ?, ?, ?, ?)
Params: Array
(
    [0] => 2025-09-03 00:00:00
    [1] => 2025-09-05 23:59:59
    [2] => <p>Texto prueba 1</p>
    [3] => Prueba 1
    [4] => Importantes
    [5] => 
)

Execute result: SUCCESS
Affected rows: 1
Transaction committed successfully
Final response: {"msg":"El mensaje se guard\u00f3 con \u00e9xito.","error":false,"focus":""}
=== END DEBUG ===

=== SAVE RECORD DEBUG ===
POST data: Array
(
    [titulo] => Promocion Gastos Medicos
    [hora_inicial] => 
    [hora_exp] => 
    [color] => Avisos temporales
    [repetitivo] => 1
    [repeat_dates] => 01/09/2025,15/09/2025,30/09/2025
    [mensaje] => <p>Promocion gastos medicos</p>
    [repetitivo_fechas] => ["2025-09-01 00:00:00","2025-09-15 00:00:00","2025-09-30 00:00:00"]
    [todo_el_dia] => 1
)

FILES data: Array
(
    [files] => Array
        (
            [name] => 
            [full_path] => 
            [type] => 
            [tmp_name] => 
            [error] => 4
            [size] => 0
        )

    [pdf] => Array
        (
            [name] => FODA fase 2.png
            [full_path] => FODA fase 2.png
            [type] => image/png
            [tmp_name] => C:\xampp\tmp\php53C2.tmp
            [error] => 0
            [size] => 129318
        )

)

repetitivo_fechas exists: YES
repetitivo_fechas value: ["2025-09-01 00:00:00","2025-09-15 00:00:00","2025-09-30 00:00:00"]
repetitivo_fechas empty check: NOT EMPTY
After validation - error: FALSE
Category: Avisos temporales
Starting database operations...
PDF filename: 68b86312a855b.png
Processing repetitive dates...
Decoded dates: Array
(
    [0] => 2025-09-01 00:00:00
    [1] => 2025-09-15 00:00:00
    [2] => 2025-09-30 00:00:00
)

SQL: INSERT INTO memos (repetitivo_fechas, contenido, titulo, color, pdf) VALUES (?, ?, ?, ?, ?)
Params: Array
(
    [0] => ["2025-09-01 00:00:00","2025-09-15 00:00:00","2025-09-30 00:00:00"]
    [1] => <p>Promocion gastos medicos</p>
    [2] => Promocion Gastos Medicos
    [3] => Avisos temporales
    [4] => 68b86312a855b.png
)

Execute result: SUCCESS
Affected rows: 1
Transaction committed successfully
Final response: {"msg":"El mensaje se guard\u00f3 con \u00e9xito.","error":false,"focus":""}
=== END DEBUG ===

=== SAVE RECORD DEBUG ===
POST data: Array
(
    [titulo] => AXA - Anuncuio
    [hora_inicial] => 
    [hora_exp] => 
    [color] => Otros
    [repetitivo] => 1
    [repeat_dates] => 05/09/2025,10/09/2025,15/09/2025,20/09/2025
    [mensaje] => <p>Prueba&nbsp;</p>
    [repetitivo_fechas] => ["2025-09-05 00:00:00","2025-09-10 00:00:00","2025-09-15 00:00:00","2025-09-20 00:00:00"]
    [todo_el_dia] => 1
)

FILES data: Array
(
    [files] => Array
        (
            [name] => 
            [full_path] => 
            [type] => 
            [tmp_name] => 
            [error] => 4
            [size] => 0
        )

    [pdf] => Array
        (
            [name] => 
            [full_path] => 
            [type] => 
            [tmp_name] => 
            [error] => 4
            [size] => 0
        )

)

repetitivo_fechas exists: YES
repetitivo_fechas value: ["2025-09-05 00:00:00","2025-09-10 00:00:00","2025-09-15 00:00:00","2025-09-20 00:00:00"]
repetitivo_fechas empty check: NOT EMPTY
After validation - error: FALSE
Category: Otros
Starting database operations...
PDF filename: NULL
Processing repetitive dates...
Decoded dates: Array
(
    [0] => 2025-09-05 00:00:00
    [1] => 2025-09-10 00:00:00
    [2] => 2025-09-15 00:00:00
    [3] => 2025-09-20 00:00:00
)

SQL: INSERT INTO memos (repetitivo_fechas, contenido, titulo, color, pdf) VALUES (?, ?, ?, ?, ?)
Params: Array
(
    [0] => ["2025-09-05 00:00:00","2025-09-10 00:00:00","2025-09-15 00:00:00","2025-09-20 00:00:00"]
    [1] => <p>Prueba&nbsp;</p>
    [2] => AXA - Anuncuio
    [3] => Otros
    [4] => 
)

Execute result: SUCCESS
Affected rows: 1
Transaction committed successfully
Final response: {"msg":"El mensaje se guard\u00f3 con \u00e9xito.","error":false,"focus":""}
=== END DEBUG ===

=== SAVE RECORD DEBUG ===
POST data: Array
(
    [titulo] => Prueba 73
    [hora_inicial] => 
    [hora_exp] => 
    [color] => Otros
    [repetitivo] => 1
    [repeat_dates] => 06/09/2025,12/09/2025,18/09/2025,24/09/2025,30/09/2025
    [mensaje] => <p>Prueba 73</p>
    [repetitivo_fechas] => ["2025-09-06 00:00:00","2025-09-12 00:00:00","2025-09-18 00:00:00","2025-09-24 00:00:00","2025-09-30 00:00:00"]
    [todo_el_dia] => 1
)

FILES data: Array
(
    [files] => Array
        (
            [name] => 
            [full_path] => 
            [type] => 
            [tmp_name] => 
            [error] => 4
            [size] => 0
        )

    [pdf] => Array
        (
            [name] => 
            [full_path] => 
            [type] => 
            [tmp_name] => 
            [error] => 4
            [size] => 0
        )

)

repetitivo_fechas exists: YES
repetitivo_fechas value: ["2025-09-06 00:00:00","2025-09-12 00:00:00","2025-09-18 00:00:00","2025-09-24 00:00:00","2025-09-30 00:00:00"]
repetitivo_fechas empty check: NOT EMPTY
After validation - error: FALSE
Category: Otros
Starting database operations...
PDF filename: NULL
Processing repetitive dates...
Decoded dates: Array
(
    [0] => 2025-09-06 00:00:00
    [1] => 2025-09-12 00:00:00
    [2] => 2025-09-18 00:00:00
    [3] => 2025-09-24 00:00:00
    [4] => 2025-09-30 00:00:00
)

SQL: INSERT INTO memos (repetitivo_fechas, contenido, titulo, color, pdf) VALUES (?, ?, ?, ?, ?)
Params: Array
(
    [0] => ["2025-09-06 00:00:00","2025-09-12 00:00:00","2025-09-18 00:00:00","2025-09-24 00:00:00","2025-09-30 00:00:00"]
    [1] => <p>Prueba 73</p>
    [2] => Prueba 73
    [3] => Otros
    [4] => 
)

Execute result: SUCCESS
Affected rows: 1
Transaction committed successfully
Final response: {"msg":"El mensaje se guard\u00f3 con \u00e9xito.","error":false,"focus":""}
=== END DEBUG ===

=== SAVE RECORD DEBUG ===
POST data: Array
(
    [id] => 534
    [titulo] => Prueba 73
    [hora_inicial] => 
    [hora_exp] => 
    [color] => Importantes
    [repetitivo] => 1
    [repeat_dates] => 06 00:00:00/09/2025,12 00:00:00/09/2025,18 00:00:00/09/2025,24 00:00:00/09/2025,30 00:00:00/09/2025
    [mensaje] => <p>Prueba 73</p>
    [repetitivo_fechas] => ["2025-09-06 00:00:00","2025-09-12 00:00:00","2025-09-18 00:00:00","2025-09-24 00:00:00","2025-09-30 00:00:00"]
    [todo_el_dia] => 1
)

FILES data: Array
(
    [files] => Array
        (
            [name] => 
            [full_path] => 
            [type] => 
            [tmp_name] => 
            [error] => 4
            [size] => 0
        )

    [pdf] => Array
        (
            [name] => 
            [full_path] => 
            [type] => 
            [tmp_name] => 
            [error] => 4
            [size] => 0
        )

)

repetitivo_fechas exists: YES
repetitivo_fechas value: ["2025-09-06 00:00:00","2025-09-12 00:00:00","2025-09-18 00:00:00","2025-09-24 00:00:00","2025-09-30 00:00:00"]
repetitivo_fechas empty check: NOT EMPTY
After validation - error: FALSE
Category: Importantes
Starting database operations...
PDF filename: NULL
Processing repetitive dates...
Decoded dates: Array
(
    [0] => 2025-09-06 00:00:00
    [1] => 2025-09-12 00:00:00
    [2] => 2025-09-18 00:00:00
    [3] => 2025-09-24 00:00:00
    [4] => 2025-09-30 00:00:00
)

SQL: UPDATE memos SET repetitivo_fechas = ?, contenido = ?, titulo = ?, color = ?, pdf = ?, fecha = NULL, fechaExp = NULL WHERE id = ?
Params: Array
(
    [0] => ["2025-09-06 00:00:00","2025-09-12 00:00:00","2025-09-18 00:00:00","2025-09-24 00:00:00","2025-09-30 00:00:00"]
    [1] => <p>Prueba 73</p>
    [2] => Prueba 73
    [3] => Importantes
    [4] => 
    [5] => 534
)

Execute result: SUCCESS
Affected rows: 1
Transaction committed successfully
Final response: {"msg":"El mensaje se guard\u00f3 con \u00e9xito.","error":false,"focus":""}
=== END DEBUG ===

=== SAVE RECORD DEBUG ===
POST data: Array
(
    [id] => 534
    [titulo] => Prueba 73
    [hora_inicial] => 
    [hora_exp] => 
    [color] => Importantes
    [repetitivo] => 1
    [repeat_dates] => 
    [mensaje] => <p>Prueba 73</p>
    [repetitivo_fechas] => []
    [todo_el_dia] => 1
)

FILES data: Array
(
    [files] => Array
        (
            [name] => 
            [full_path] => 
            [type] => 
            [tmp_name] => 
            [error] => 4
            [size] => 0
        )

    [pdf] => Array
        (
            [name] => 
            [full_path] => 
            [type] => 
            [tmp_name] => 
            [error] => 4
            [size] => 0
        )

)

repetitivo_fechas exists: YES
repetitivo_fechas value: []
repetitivo_fechas empty check: NOT EMPTY
After validation - error: FALSE
Category: Importantes
Starting database operations...
PDF filename: NULL
Processing repetitive dates...
Decoded dates: Array
(
)

General Error: Formato de fechas repetitivas invlido
Final response: {"msg":"Formato de fechas repetitivas inv\u00e1lido","error":true,"focus":""}
=== END DEBUG ===

=== SAVE RECORD DEBUG ===
POST data: Array
(
    [id] => 534
    [titulo] => Prueba 73
    [hora_inicial] => 
    [hora_exp] => 
    [color] => Avisos temporales
    [repetitivo] => 1
    [repeat_dates] => 06 00:00:00/09/2025,12 00:00:00/09/2025,18 00:00:00/09/2025,24 00:00:00/09/2025,30 00:00:00/09/2025
    [mensaje] => <p>Prueba 73</p>
    [repetitivo_fechas] => ["2025-09-06 00:00:00","2025-09-12 00:00:00","2025-09-18 00:00:00","2025-09-24 00:00:00","2025-09-30 00:00:00"]
    [todo_el_dia] => 1
)

FILES data: Array
(
    [files] => Array
        (
            [name] => 
            [full_path] => 
            [type] => 
            [tmp_name] => 
            [error] => 4
            [size] => 0
        )

    [pdf] => Array
        (
            [name] => 
            [full_path] => 
            [type] => 
            [tmp_name] => 
            [error] => 4
            [size] => 0
        )

)

repetitivo_fechas exists: YES
repetitivo_fechas value: ["2025-09-06 00:00:00","2025-09-12 00:00:00","2025-09-18 00:00:00","2025-09-24 00:00:00","2025-09-30 00:00:00"]
repetitivo_fechas empty check: NOT EMPTY
After validation - error: FALSE
Category: Avisos temporales
Starting database operations...
PDF filename: NULL
Processing repetitive dates...
Decoded dates: Array
(
    [0] => 2025-09-06 00:00:00
    [1] => 2025-09-12 00:00:00
    [2] => 2025-09-18 00:00:00
    [3] => 2025-09-24 00:00:00
    [4] => 2025-09-30 00:00:00
)

SQL: UPDATE memos SET repetitivo_fechas = ?, contenido = ?, titulo = ?, color = ?, pdf = ?, fecha = NULL, fechaExp = NULL WHERE id = ?
Params: Array
(
    [0] => ["2025-09-06 00:00:00","2025-09-12 00:00:00","2025-09-18 00:00:00","2025-09-24 00:00:00","2025-09-30 00:00:00"]
    [1] => <p>Prueba 73</p>
    [2] => Prueba 73
    [3] => Avisos temporales
    [4] => 
    [5] => 534
)

Execute result: SUCCESS
Affected rows: 1
Transaction committed successfully
Final response: {"msg":"El mensaje se guard\u00f3 con \u00e9xito.","error":false,"focus":""}
=== END DEBUG ===

=== SAVE RECORD DEBUG ===
POST data: Array
(
    [titulo] => 
    [hora_inicial] => 
    [hora_exp] => 
    [color] => Otros
    [repetitivo] => 1
    [repeat_dates] => 05/09/2025,06/09/2025
    [mensaje] => 
    [repetitivo_fechas] => ["2025-09-05 00:00:00","2025-09-06 00:00:00"]
    [todo_el_dia] => 1
)

FILES data: Array
(
    [files] => Array
        (
            [name] => 
            [full_path] => 
            [type] => 
            [tmp_name] => 
            [error] => 4
            [size] => 0
        )

    [pdf] => Array
        (
            [name] => 
            [full_path] => 
            [type] => 
            [tmp_name] => 
            [error] => 4
            [size] => 0
        )

)

repetitivo_fechas exists: YES
repetitivo_fechas value: ["2025-09-05 00:00:00","2025-09-06 00:00:00"]
repetitivo_fechas empty check: NOT EMPTY
Validation error: El campo titulo es obligatorio. for field: titulo
After validation - error: TRUE
Category: Otros
Skipping database operations due to validation error
Final response: {"msg":"El campo titulo es obligatorio.","error":true,"focus":"titulo"}
=== END DEBUG ===

=== SAVE RECORD DEBUG ===
POST data: Array
(
    [titulo] => dd
    [fecha] => 
    [hora_inicial] => 
    [fecha_exp] => 
    [hora_exp] => 
    [color] => Otros
    [repetitivo] => 1
    [repeat_dates] => 05/09/2025,06/09/2025
    [mensaje] => 
    [repetitivo_fechas] => ["2025-09-05 00:00:00","2025-09-06 00:00:00"]
    [todo_el_dia] => 1
)

FILES data: Array
(
    [files] => Array
        (
            [name] => 
            [full_path] => 
            [type] => 
            [tmp_name] => 
            [error] => 4
            [size] => 0
        )

    [pdf] => Array
        (
            [name] => 
            [full_path] => 
            [type] => 
            [tmp_name] => 
            [error] => 4
            [size] => 0
        )

)

repetitivo_fechas exists: YES
repetitivo_fechas value: ["2025-09-05 00:00:00","2025-09-06 00:00:00"]
repetitivo_fechas empty check: NOT EMPTY
Validation error: El campo mensaje es obligatorio. for field: mensaje
After validation - error: TRUE
Category: Otros
Skipping database operations due to validation error
Final response: {"msg":"El campo mensaje es obligatorio.","error":true,"focus":"mensaje"}
=== END DEBUG ===

=== SAVE RECORD DEBUG ===
POST data: Array
(
    [titulo] => dd
    [fecha] => 
    [hora_inicial] => 
    [fecha_exp] => 
    [hora_exp] => 
    [color] => Otros
    [repetitivo] => 1
    [repeat_dates] => 05/09/2025,06/09/2025
    [mensaje] => <p><a href="https://www.google.com">https://www.google.com</a>&nbsp;uhum <a href="https://www.google.com">https://www.google.com</a>&nbsp;</p>
    [repetitivo_fechas] => ["2025-09-05 00:00:00","2025-09-06 00:00:00"]
    [todo_el_dia] => 1
)

FILES data: Array
(
    [files] => Array
        (
            [name] => 
            [full_path] => 
            [type] => 
            [tmp_name] => 
            [error] => 4
            [size] => 0
        )

    [pdf] => Array
        (
            [name] => 
            [full_path] => 
            [type] => 
            [tmp_name] => 
            [error] => 4
            [size] => 0
        )

)

repetitivo_fechas exists: YES
repetitivo_fechas value: ["2025-09-05 00:00:00","2025-09-06 00:00:00"]
repetitivo_fechas empty check: NOT EMPTY
After validation - error: FALSE
Category: Otros
Starting database operations...
PDF filename: NULL
Processing repetitive dates...
Decoded dates: Array
(
    [0] => 2025-09-05 00:00:00
    [1] => 2025-09-06 00:00:00
)

SQL: INSERT INTO memos (repetitivo_fechas, contenido, titulo, color, pdf) VALUES (?, ?, ?, ?, ?)
Params: Array
(
    [0] => ["2025-09-05 00:00:00","2025-09-06 00:00:00"]
    [1] => <p><a href="https://www.google.com">https://www.google.com</a>&nbsp;uhum <a href="https://www.google.com">https://www.google.com</a>&nbsp;</p>
    [2] => dd
    [3] => Otros
    [4] => 
)

Execute result: SUCCESS
Affected rows: 1
Transaction committed successfully
Final response: {"msg":"El mensaje se guard\u00f3 con \u00e9xito.","error":false,"focus":""}
=== END DEBUG ===

=== SAVE RECORD DEBUG ===
POST data: Array
(
    [titulo] => prueba 2
    [fecha] => 05/09/2025
    [hora_inicial] => 
    [fecha_exp] => 06/09/2025
    [hora_exp] => 
    [color] => Circular
    [repeat_dates] => 
    [mensaje] => <p>ccc</p>
    [fecha_datetime] => 2025-09-05 00:00:00
    [fecha_exp_datetime] => 2025-09-06 23:59:00
    [todo_el_dia] => 1
)

FILES data: Array
(
    [files] => Array
        (
            [name] => 
            [full_path] => 
            [type] => 
            [tmp_name] => 
            [error] => 4
            [size] => 0
        )

    [pdf] => Array
        (
            [name] => 
            [full_path] => 
            [type] => 
            [tmp_name] => 
            [error] => 4
            [size] => 0
        )

)

repetitivo_fechas exists: NO
After validation - error: FALSE
Category: Circular
Starting database operations...
PDF filename: NULL
Processing regular dates...
Processed fecha: 2025-09-05 00:00:00
Processed fechaExp: 2025-09-06 23:59:59
SQL: INSERT INTO memos (fecha, fechaExp, contenido, titulo, color, pdf) VALUES (?, ?, ?, ?, ?, ?)
Params: Array
(
    [0] => 2025-09-05 00:00:00
    [1] => 2025-09-06 23:59:59
    [2] => <p>ccc</p>
    [3] => prueba 2
    [4] => Circular
    [5] => 
)

Execute result: SUCCESS
Affected rows: 1
Transaction committed successfully
Final response: {"msg":"El mensaje se guard\u00f3 con \u00e9xito.","error":false,"focus":""}
=== END DEBUG ===

=== SAVE RECORD DEBUG ===
POST data: Array
(
    [id] => 536
    [titulo] => prueba 2
    [fecha] => 05/09/2025
    [hora_inicial] => 02:03
    [fecha_exp] => 06/09/2025
    [hora_exp] => 23:56
    [color] => Circular
    [repeat_dates] => 
    [mensaje] => <p>ccc</p>
    [fecha_datetime] => 2025-09-05 02:03:00
    [fecha_exp_datetime] => 2025-09-06 23:56:00
    [todo_el_dia] => 0
)

FILES data: Array
(
    [files] => Array
        (
            [name] => 
            [full_path] => 
            [type] => 
            [tmp_name] => 
            [error] => 4
            [size] => 0
        )

    [pdf] => Array
        (
            [name] => 
            [full_path] => 
            [type] => 
            [tmp_name] => 
            [error] => 4
            [size] => 0
        )

)

repetitivo_fechas exists: NO
After validation - error: FALSE
Category: Circular
Starting database operations...
PDF filename: NULL
Processing regular dates...
Processed fecha: 2025-09-05 02:03:00
Processed fechaExp: 2025-09-06 23:56:00
SQL: UPDATE memos SET fecha = ?, fechaExp = ?, contenido = ?, titulo = ?, color = ?, pdf = ?, repetitivo_fechas = NULL WHERE id = ?
Params: Array
(
    [0] => 2025-09-05 02:03:00
    [1] => 2025-09-06 23:56:00
    [2] => <p>ccc</p>
    [3] => prueba 2
    [4] => Circular
    [5] => 
    [6] => 536
)

Execute result: SUCCESS
Affected rows: 1
Transaction committed successfully
Final response: {"msg":"El mensaje se guard\u00f3 con \u00e9xito.","error":false,"focus":""}
=== END DEBUG ===

=== SAVE RECORD DEBUG ===
POST data: Array
(
    [titulo] => cccc
    [hora_inicial] => 14:17
    [hora_exp] => 17:21
    [color] => Otros
    [repetitivo] => 1
    [repeat_dates] => 05/09/2025,12/09/2025
    [mensaje] => <p>cccc</p>
    [repetitivo_fechas] => ["2025-09-05 00:00:00","2025-09-12 00:00:00"]
    [todo_el_dia] => 0
)

FILES data: Array
(
    [files] => Array
        (
            [name] => 
            [full_path] => 
            [type] => 
            [tmp_name] => 
            [error] => 4
            [size] => 0
        )

    [pdf] => Array
        (
            [name] => 
            [full_path] => 
            [type] => 
            [tmp_name] => 
            [error] => 4
            [size] => 0
        )

)

repetitivo_fechas exists: YES
repetitivo_fechas value: ["2025-09-05 00:00:00","2025-09-12 00:00:00"]
repetitivo_fechas empty check: NOT EMPTY
After validation - error: FALSE
Category: Otros
Starting database operations...
PDF filename: NULL
Processing repetitive dates...
Decoded dates: Array
(
    [0] => 2025-09-05 00:00:00
    [1] => 2025-09-12 00:00:00
)

SQL: INSERT INTO memos (repetitivo_fechas, contenido, titulo, color, pdf) VALUES (?, ?, ?, ?, ?)
Params: Array
(
    [0] => ["2025-09-05 00:00:00","2025-09-12 00:00:00"]
    [1] => <p>cccc</p>
    [2] => cccc
    [3] => Otros
    [4] => 
)

Execute result: SUCCESS
Affected rows: 1
Transaction committed successfully
Final response: {"msg":"El mensaje se guard\u00f3 con \u00e9xito.","error":false,"focus":""}
=== END DEBUG ===

=== SAVE RECORD DEBUG ===
POST data: Array
(
    [titulo] => sss
    [hora_inicial] => 
    [hora_exp] => 
    [color] => Otros
    [repetitivo] => 1
    [repeat_dates] => 15/09/2025,17/09/2025
    [mensaje] => <p>ssss</p>
    [repetitivo_fechas] => ["2025-09-15 00:00:00","2025-09-17 00:00:00"]
    [todo_el_dia] => 1
)

FILES data: Array
(
    [files] => Array
        (
            [name] => 
            [full_path] => 
            [type] => 
            [tmp_name] => 
            [error] => 4
            [size] => 0
        )

    [pdf] => Array
        (
            [name] => 
            [full_path] => 
            [type] => 
            [tmp_name] => 
            [error] => 4
            [size] => 0
        )

)

repetitivo_fechas exists: YES
repetitivo_fechas value: ["2025-09-15 00:00:00","2025-09-17 00:00:00"]
repetitivo_fechas empty check: NOT EMPTY
After validation - error: FALSE
Category: Otros
Starting database operations...
PDF filename: NULL
Processing repetitive dates...
Decoded dates: Array
(
    [0] => 2025-09-15 00:00:00
    [1] => 2025-09-17 00:00:00
)

SQL: INSERT INTO memos (repetitivo_fechas, contenido, titulo, color, pdf) VALUES (?, ?, ?, ?, ?)
Params: Array
(
    [0] => ["2025-09-15 00:00:00","2025-09-17 00:00:00"]
    [1] => <p>ssss</p>
    [2] => sss
    [3] => Otros
    [4] => 
)

Execute result: SUCCESS
Affected rows: 1
Transaction committed successfully
Final response: {"msg":"El mensaje se guard\u00f3 con \u00e9xito.","error":false,"focus":""}
=== END DEBUG ===

=== SAVE RECORD DEBUG ===
POST data: Array
(
    [id] => 538
    [titulo] => sss
    [hora_inicial] => 12:22
    [hora_exp] => 14:20
    [color] => Otros
    [repetitivo] => 1
    [repeat_dates] => 15 00:00:00/09/2025,17 00:00:00/09/2025
    [mensaje] => <p>ssss</p>
    [repetitivo_fechas] => ["2025-09-15 00:00:00","2025-09-17 00:00:00"]
    [todo_el_dia] => 1
)

FILES data: Array
(
    [files] => Array
        (
            [name] => 
            [full_path] => 
            [type] => 
            [tmp_name] => 
            [error] => 4
            [size] => 0
        )

    [pdf] => Array
        (
            [name] => 
            [full_path] => 
            [type] => 
            [tmp_name] => 
            [error] => 4
            [size] => 0
        )

)

repetitivo_fechas exists: YES
repetitivo_fechas value: ["2025-09-15 00:00:00","2025-09-17 00:00:00"]
repetitivo_fechas empty check: NOT EMPTY
After validation - error: FALSE
Category: Otros
Starting database operations...
PDF filename: NULL
Processing repetitive dates...
Decoded dates: Array
(
    [0] => 2025-09-15 00:00:00
    [1] => 2025-09-17 00:00:00
)

SQL: UPDATE memos SET repetitivo_fechas = ?, contenido = ?, titulo = ?, color = ?, pdf = ?, fecha = NULL, fechaExp = NULL WHERE id = ?
Params: Array
(
    [0] => ["2025-09-15 00:00:00","2025-09-17 00:00:00"]
    [1] => <p>ssss</p>
    [2] => sss
    [3] => Otros
    [4] => 
    [5] => 538
)

Execute result: SUCCESS
Affected rows: 0
Transaction committed successfully
Final response: {"msg":"El mensaje se guard\u00f3 con \u00e9xito.","error":false,"focus":""}
=== END DEBUG ===

=== SAVE RECORD DEBUG ===
POST data: Array
(
    [titulo] => aaa
    [fecha] => 04/09/2025
    [hora_inicial] => 15:31
    [fecha_exp] => 07/09/2025
    [hora_exp] => 18:45
    [color] => Circular
    [repeat_dates] => 
    [mensaje] => <p>aaa</p>
    [fecha_datetime] => 2025-09-04 15:31:00
    [fecha_exp_datetime] => 2025-09-07 18:45:00
    [todo_el_dia] => 0
)

FILES data: Array
(
    [files] => Array
        (
            [name] => 
            [full_path] => 
            [type] => 
            [tmp_name] => 
            [error] => 4
            [size] => 0
        )

    [pdf] => Array
        (
            [name] => 
            [full_path] => 
            [type] => 
            [tmp_name] => 
            [error] => 4
            [size] => 0
        )

)

repetitivo_fechas exists: NO
After validation - error: FALSE
Category: Circular
Starting database operations...
PDF filename: NULL
Processing regular dates...
Processed fecha: 2025-09-04 15:31:00
Processed fechaExp: 2025-09-07 18:45:00
SQL: INSERT INTO memos (fecha, fechaExp, contenido, titulo, color, pdf) VALUES (?, ?, ?, ?, ?, ?)
Params: Array
(
    [0] => 2025-09-04 15:31:00
    [1] => 2025-09-07 18:45:00
    [2] => <p>aaa</p>
    [3] => aaa
    [4] => Circular
    [5] => 
)

Execute result: SUCCESS
Affected rows: 1
Transaction committed successfully
Final response: {"msg":"El mensaje se guard\u00f3 con \u00e9xito.","error":false,"focus":""}
=== END DEBUG ===

=== SAVE RECORD DEBUG ===
POST data: Array
(
    [id] => 539
    [titulo] => aaa
    [fecha] => 04/09/2025
    [hora_inicial] => 15:31
    [fecha_exp] => 07/09/2025
    [hora_exp] => 18:45
    [color] => Circular
    [repeat_dates] => 
    [mensaje] => <p>aaa</p>
    [fecha_datetime] => 2025-09-04 15:31:00
    [fecha_exp_datetime] => 2025-09-07 18:45:00
    [todo_el_dia] => 0
)

FILES data: Array
(
    [files] => Array
        (
            [name] => 
            [full_path] => 
            [type] => 
            [tmp_name] => 
            [error] => 4
            [size] => 0
        )

    [pdf] => Array
        (
            [name] => 
            [full_path] => 
            [type] => 
            [tmp_name] => 
            [error] => 4
            [size] => 0
        )

)

repetitivo_fechas exists: NO
After validation - error: FALSE
Category: Circular
Starting database operations...
PDF filename: NULL
Processing regular dates...
Processed fecha: 2025-09-04 15:31:00
Processed fechaExp: 2025-09-07 18:45:00
SQL: UPDATE memos SET fecha = ?, fechaExp = ?, contenido = ?, titulo = ?, color = ?, pdf = ?, repetitivo_fechas = NULL WHERE id = ?
Params: Array
(
    [0] => 2025-09-04 15:31:00
    [1] => 2025-09-07 18:45:00
    [2] => <p>aaa</p>
    [3] => aaa
    [4] => Circular
    [5] => 
    [6] => 539
)

Execute result: SUCCESS
Affected rows: 0
Transaction committed successfully
Final response: {"msg":"El mensaje se guard\u00f3 con \u00e9xito.","error":false,"focus":""}
=== END DEBUG ===

=== SAVE RECORD DEBUG ===
POST data: Array
(
    [titulo] => bbb
    [hora_inicial] => 08:31
    [hora_exp] => 18:50
    [color] => Otros
    [repetitivo] => 1
    [repeat_dates] => 16/09/2025,26/09/2025,30/09/2025
    [mensaje] => <p>bbb</p>
    [repetitivo_fechas] => ["2025-09-16 00:00:00","2025-09-26 00:00:00","2025-09-30 00:00:00"]
    [todo_el_dia] => 0
)

FILES data: Array
(
    [files] => Array
        (
            [name] => 
            [full_path] => 
            [type] => 
            [tmp_name] => 
            [error] => 4
            [size] => 0
        )

    [pdf] => Array
        (
            [name] => 
            [full_path] => 
            [type] => 
            [tmp_name] => 
            [error] => 4
            [size] => 0
        )

)

repetitivo_fechas exists: YES
repetitivo_fechas value: ["2025-09-16 00:00:00","2025-09-26 00:00:00","2025-09-30 00:00:00"]
repetitivo_fechas empty check: NOT EMPTY
After validation - error: FALSE
Category: Otros
Starting database operations...
PDF filename: NULL
SQL: INSERT INTO memos (repetitivo_fechas, contenido, titulo, color, pdf) VALUES (?, ?, ?, ?, ?)
Params: Array
(
    [0] => [{"fecha":"2025-09-16 00:00:00","hora_inicial":"08:31","hora_exp":"18:50"},{"fecha":"2025-09-26 00:00:00","hora_inicial":"08:31","hora_exp":"18:50"},{"fecha":"2025-09-30 00:00:00","hora_inicial":"08:31","hora_exp":"18:50"}]
    [1] => <p>bbb</p>
    [2] => bbb
    [3] => Otros
    [4] => 
)

Execute result: SUCCESS
Affected rows: 1
Transaction committed successfully
Final response: {"msg":"El mensaje se guard\u00f3 con \u00e9xito.","error":false,"focus":""}
=== END DEBUG ===

=== SAVE RECORD DEBUG ===
POST data: Array
(
    [titulo] => ccc
    [fecha] => 04/09/2025
    [hora_inicial] => 02:42
    [fecha_exp] => 05/09/2025
    [hora_exp] => 17:47
    [color] => Otros
    [repeat_dates] => 
    [mensaje] => <p>ccc</p>
    [fecha_datetime] => 2025-09-04 02:42:00
    [fecha_exp_datetime] => 2025-09-05 17:47:00
    [todo_el_dia] => 0
)

FILES data: Array
(
    [files] => Array
        (
            [name] => 
            [full_path] => 
            [type] => 
            [tmp_name] => 
            [error] => 4
            [size] => 0
        )

    [pdf] => Array
        (
            [name] => 
            [full_path] => 
            [type] => 
            [tmp_name] => 
            [error] => 4
            [size] => 0
        )

)

repetitivo_fechas exists: NO
After validation - error: FALSE
Category: Otros
Starting database operations...
PDF filename: NULL
Processing regular dates...
Processed fecha: 2025-09-04 02:42:00
Processed fechaExp: 2025-09-05 17:47:00
SQL: INSERT INTO memos (fecha, fechaExp, contenido, titulo, color, pdf) VALUES (?, ?, ?, ?, ?, ?)
Params: Array
(
    [0] => 2025-09-04 02:42:00
    [1] => 2025-09-05 17:47:00
    [2] => <p>ccc</p>
    [3] => ccc
    [4] => Otros
    [5] => 
)

Execute result: SUCCESS
Affected rows: 1
Transaction committed successfully
Final response: {"msg":"El mensaje se guard\u00f3 con \u00e9xito.","error":false,"focus":""}
=== END DEBUG ===

=== SAVE RECORD DEBUG ===
POST data: Array
(
    [titulo] => hghghghghghghghg
    [hora_inicial] => 18:55
    [hora_exp] => 22:59
    [color] => Avisos temporales
    [repetitivo] => 1
    [repeat_dates] => 17/09/2025,18/09/2025,19/09/2025
    [mensaje] => <p>ccddcdcdc</p>
    [repetitivo_fechas] => ["2025-09-17 00:00:00","2025-09-18 00:00:00","2025-09-19 00:00:00"]
    [todo_el_dia] => 0
)

FILES data: Array
(
    [files] => Array
        (
            [name] => 
            [full_path] => 
            [type] => 
            [tmp_name] => 
            [error] => 4
            [size] => 0
        )

    [pdf] => Array
        (
            [name] => 
            [full_path] => 
            [type] => 
            [tmp_name] => 
            [error] => 4
            [size] => 0
        )

)

repetitivo_fechas exists: YES
repetitivo_fechas value: ["2025-09-17 00:00:00","2025-09-18 00:00:00","2025-09-19 00:00:00"]
repetitivo_fechas empty check: NOT EMPTY
After validation - error: FALSE
Category: Avisos temporales
Starting database operations...
PDF filename: NULL
SQL: INSERT INTO memos (repetitivo_fechas, contenido, titulo, color, pdf) VALUES (?, ?, ?, ?, ?)
Params: Array
(
    [0] => [{"fecha":"2025-09-17 00:00:00","hora_inicial":"18:55","hora_exp":"22:59"},{"fecha":"2025-09-18 00:00:00","hora_inicial":"18:55","hora_exp":"22:59"},{"fecha":"2025-09-19 00:00:00","hora_inicial":"18:55","hora_exp":"22:59"}]
    [1] => <p>ccddcdcdc</p>
    [2] => hghghghghghghghg
    [3] => Avisos temporales
    [4] => 
)

Execute result: SUCCESS
Affected rows: 1
Transaction committed successfully
Final response: {"msg":"El mensaje se guard\u00f3 con \u00e9xito.","error":false,"focus":""}
=== END DEBUG ===

=== SAVE RECORD DEBUG ===
POST data: Array
(
    [titulo] => prueba dias multiples
    [hora_inicial] => 
    [hora_exp] => 
    [color] => Importantes
    [repetitivo] => 1
    [repeat_pattern] => daily
    [repeat_frequency] => 3
    [repeat_count] => 8
    [repeat_until] => 
    [repeat_dates] => 
    [repeat_config] => {"baseDates":["12/09/2025"],"pattern":"daily","frequency":3,"count":8,"until":"","generatedCount":9}
    [mensaje] => <p>dddd</p>
    [repetitivo_fechas] => ["2025-09-12 00:00:00","2025-09-15 00:00:00","2025-09-18 00:00:00","2025-09-21 00:00:00","2025-09-24 00:00:00","2025-09-27 00:00:00","2025-09-30 00:00:00","2025-10-03 00:00:00","2025-10-06 00:00:00"]
    [todo_el_dia] => 1
)

FILES data: Array
(
    [files] => Array
        (
            [name] => 
            [full_path] => 
            [type] => 
            [tmp_name] => 
            [error] => 4
            [size] => 0
        )

    [pdf] => Array
        (
            [name] => 
            [full_path] => 
            [type] => 
            [tmp_name] => 
            [error] => 4
            [size] => 0
        )

)

repetitivo_fechas exists: YES
repetitivo_fechas value: ["2025-09-12 00:00:00","2025-09-15 00:00:00","2025-09-18 00:00:00","2025-09-21 00:00:00","2025-09-24 00:00:00","2025-09-27 00:00:00","2025-09-30 00:00:00","2025-10-03 00:00:00","2025-10-06 00:00:00"]
repetitivo_fechas empty check: NOT EMPTY
After validation - error: FALSE
Category: Importantes
Starting database operations...
PDF filename: NULL
SQL: INSERT INTO memos (repetitivo_fechas, contenido, titulo, color, pdf) VALUES (?, ?, ?, ?, ?)
Params: Array
(
    [0] => [{"fecha":"2025-09-12 00:00:00","hora_inicial":"00:00:00","hora_exp":"23:59:00"},{"fecha":"2025-09-15 00:00:00","hora_inicial":"00:00:00","hora_exp":"23:59:00"},{"fecha":"2025-09-18 00:00:00","hora_inicial":"00:00:00","hora_exp":"23:59:00"},{"fecha":"2025-09-21 00:00:00","hora_inicial":"00:00:00","hora_exp":"23:59:00"},{"fecha":"2025-09-24 00:00:00","hora_inicial":"00:00:00","hora_exp":"23:59:00"},{"fecha":"2025-09-27 00:00:00","hora_inicial":"00:00:00","hora_exp":"23:59:00"},{"fecha":"2025-09-30 00:00:00","hora_inicial":"00:00:00","hora_exp":"23:59:00"},{"fecha":"2025-10-03 00:00:00","hora_inicial":"00:00:00","hora_exp":"23:59:00"},{"fecha":"2025-10-06 00:00:00","hora_inicial":"00:00:00","hora_exp":"23:59:00"}]
    [1] => <p>dddd</p>
    [2] => prueba dias multiples
    [3] => Importantes
    [4] => 
)

Execute result: SUCCESS
Affected rows: 1
Transaction committed successfully
Final response: {"msg":"El mensaje se guard\u00f3 con \u00e9xito.","error":false,"focus":""}
=== END DEBUG ===

=== SAVE RECORD DEBUG ===
POST data: Array
(
    [color] => Importantes
    [repetitivo_fechas] => []
    [todo_el_dia] => 1
)

FILES data: Array
(
)

repetitivo_fechas exists: YES
repetitivo_fechas value: []
repetitivo_fechas empty check: NOT EMPTY
After validation - error: FALSE
Category: Importantes
Starting database operations...
PDF filename: NULL
General Error: Formato de fechas repetitivas invlido
Final response: {"msg":"Formato de fechas repetitivas inv\u00e1lido","error":true,"focus":""}
=== END DEBUG ===

=== SAVE RECORD DEBUG ===
POST data: Array
(
    [titulo] => prueba1
    [hora_inicial] => 01:20
    [hora_exp] => 18:31
    [color] => Otros
    [repetitivo] => 1
    [repeat_pattern] => weekly
    [repeat_frequency] => 1
    [repeat_count] => 3
    [repeat_until] => 
    [repeat_dates] => 
    [repeat_config] => {"baseDates":["13/09/2025"],"pattern":"weekly","frequency":1,"count":3,"until":"","generatedCount":4}
    [mensaje] => <p>ccc</p>
    [repetitivo_fechas] => ["2025-09-13 00:00:00","2025-09-20 00:00:00","2025-09-27 00:00:00","2025-10-04 00:00:00"]
    [todo_el_dia] => 0
)

FILES data: Array
(
    [files] => Array
        (
            [name] => 
            [full_path] => 
            [type] => 
            [tmp_name] => 
            [error] => 4
            [size] => 0
        )

    [pdf] => Array
        (
            [name] => 
            [full_path] => 
            [type] => 
            [tmp_name] => 
            [error] => 4
            [size] => 0
        )

)

Category: Otros
Starting database operations...
PDF filename: NULL
Processing repetitive dates...
Processed 4 repetitive dates
SQL: INSERT INTO memos (repetitivo_fechas, repeat_config, contenido, titulo, color, pdf, created_at) 
								VALUES (?, ?, ?, ?, ?, ?, NOW())
Params: Array
(
    [0] => ["2025-09-13 01:20:00","2025-09-20 01:20:00","2025-09-27 01:20:00","2025-10-04 01:20:00"]
    [1] => {"baseDates":["13\/09\/2025"],"pattern":"weekly","frequency":1,"count":3,"until":"","generatedCount":4,"hora_inicial":"01:20","hora_exp":"18:31","todo_el_dia":"0","processed_count":4,"created_at":"2025-09-11 11:18:07"}
    [2] => <p>ccc</p>
    [3] => prueba1
    [4] => Otros
    [5] => 
)

PDO Error: SQLSTATE[42S22]: Column not found: 1054 Unknown column 'repeat_config' in 'field list'
Final response: {"msg":"Error en la base de datos: SQLSTATE[42S22]: Column not found: 1054 Unknown column 'repeat_config' in 'field list'","error":true,"focus":""}
=== END DEBUG ===

=== SAVE RECORD DEBUG ===
POST data: Array
(
    [color] => Otros
    [repetitivo_fechas] => []
    [todo_el_dia] => 0
)

FILES data: Array
(
)

Category: Otros
Starting database operations...
PDF filename: NULL
Processing repetitive dates...
General Error: Formato de fechas repetitivas invlido
Final response: {"msg":"Formato de fechas repetitivas inv\u00e1lido","error":true,"focus":""}
=== END DEBUG ===

=== SAVE RECORD DEBUG ===
POST data: Array
(
    [titulo] => prueba1
    [hora_inicial] => 13:19
    [hora_exp] => 17:30
    [color] => Importantes
    [repetitivo] => 1
    [repeat_pattern] => weekly
    [repeat_frequency] => 1
    [repeat_count] => 4
    [repeat_until] => 
    [repeat_dates] => 
    [repeat_config] => {"baseDates":["13/09/2025"],"pattern":"weekly","frequency":1,"count":4,"until":"","generatedCount":5}
    [mensaje] => <p>xxxxx</p>
    [repetitivo_fechas] => ["2025-09-13 00:00:00","2025-09-20 00:00:00","2025-09-27 00:00:00","2025-10-04 00:00:00","2025-10-11 00:00:00"]
    [todo_el_dia] => 0
)

FILES data: Array
(
    [files] => Array
        (
            [name] => 
            [full_path] => 
            [type] => 
            [tmp_name] => 
            [error] => 4
            [size] => 0
        )

    [pdf] => Array
        (
            [name] => 
            [full_path] => 
            [type] => 
            [tmp_name] => 
            [error] => 4
            [size] => 0
        )

)

repetitivo_fechas exists: YES
repetitivo_fechas value: ["2025-09-13 00:00:00","2025-09-20 00:00:00","2025-09-27 00:00:00","2025-10-04 00:00:00","2025-10-11 00:00:00"]
repetitivo_fechas empty check: NOT EMPTY
After validation - error: FALSE
